poster,imdb-id,title,release-year,runtime,genre,imdb-rating,metascore,overview,votes,directors,cast,language
"https://m.media-amazon.com/images/M/MV5BOWUwMWMxNGMtN2UwMy00ZTNmLWE4YmUtNzIxOGU2MTkyZTA5XkEyXkFqcGdeQXVyMjgyNjk3MzE@._V1_UX67_CR0,0,67,98_AL_.jpg",tt0984130,Miao Miao,2008,83.0,"Comedy, Drama, Romance",6.2,,"The bisexual owner of a record store and a new girl in town bond over Jack Kerouac. Meanwhile, a girl in her class falls in love with her.",1172,"[{'id': 'nm3171048', 'name': 'Hsiao-tse Cheng'}]","[{'id': 'nm2429015', 'name': 'Chia-Yen Ko'}, {'id': 'nm2432662', 'name': 'Sandrine Pinna'}, {'id': 'nm1254855', 'name': 'Wing Fan'}, {'id': 'nm4308851', 'name': 'Kang Ren Wu'}]",cmn
"https://m.media-amazon.com/images/M/MV5BZjU2YWQ5MWUtNGM4Zi00ZTcwLTliZGEtMTE1Nzg0ZGFmODQ1XkEyXkFqcGdeQXVyNzI1NzMxNzM@._V1_UY98_CR1,0,67,98_AL_.jpg",tt0851532,Mei Lanfang,2008,150.0,"Biography, Drama, History",6.7,,"A biographical account of Mei Lanfang, China's greatest opera star.",1607,"[{'id': 'nm0155280', 'name': 'Kaige Chen'}]","[{'id': 'nm0481709', 'name': 'Leon Lai'}, {'id': 'nm0955471', 'name': 'Ziyi Zhang'}, {'id': 'nm0838944', 'name': 'Honglei Sun'}, {'id': 'nm0155238', 'name': 'Hong Chen'}]",cmn
"https://m.media-amazon.com/images/M/MV5BZDk4MzYzZjItYTMzMy00NmE5LWIxYWItYTRmODMzN2MzMzQ5XkEyXkFqcGdeQXVyMjExMzEyNTM@._V1_UY98_CR1,0,67,98_AL_.jpg",tt2047732,Feng Yun Jue,2008,98.0,"Animation, Action, Adventure",5.7,,"When some of the greatest swordsmen in the world are brutally murdered, Wind, Cloud, and the massacre's only survivor, Ngou, battle for a blood that holds powerful gifts.",237,"[{'id': 'nm0482592', 'name': 'Dante Lam'}]","[{'id': 'nm0874866', 'name': 'Nicholas Tse'}, {'id': 'nm1332451', 'name': 'Raymond Lam'}, {'id': 'nm0719104', 'name': 'Richie Jen'}, {'id': 'nm2028473', 'name': 'Hins Cheung'}]",cmn
"https://m.media-amazon.com/images/M/MV5BMTY1MjMzMTE0NV5BMl5BanBnXkFtZTcwNTI4NTU1Mg@@._V1_UY98_CR1,0,67,98_AL_.jpg",tt1018102,Zuo you,2008,115.0,Drama,7.0,,"A divorced couple learns that the way to possibly save daughter, who is suffering from blood cancer, is to have another child. Problem is: They're both already remarried.",763,"[{'id': 'nm0911075', 'name': 'Xiaoshuai Wang'}]","[{'id': 'nm3211183', 'name': 'Weiwei Liu'}, {'id': 'nm1289005', 'name': 'Jia-yi Zhang'}, {'id': 'nm0950544', 'name': 'Nan Yu'}, {'id': 'nm1702381', 'name': 'Taishen Cheng'}]",cmn
"https://m.media-amazon.com/images/M/MV5BMjU1NmUwNjQtM2Q2Ni00MDBhLWIyM2EtMzU5YzE0MmM4YjBjXkEyXkFqcGdeQXVyMjg0MTI5NzQ@._V1_UX67_CR0,0,67,98_AL_.jpg",tt0918561,Dai yat gai,2008,95.0,"Crime, Horror, Thriller",6.2,,An action-thriller that follows the events that occur after a man calls the police to let them know of the mysterious presence in his house.,763,"[{'id': 'nm0867210', 'name': 'Kelvin Tong'}]","[{'id': 'nm1284845', 'name': 'Shawn Yue'}, {'id': 'nm0155562', 'name': 'Ekin Cheng'}, {'id': 'nm0154726', 'name': 'Stephanie Che'}, {'id': 'nm3665106', 'name': 'Renee Lee'}]",cmn
"https://m.media-amazon.com/images/M/MV5BOGJlNzExYWEtMjk0ZC00YWY3LThjNDAtNDM0NDFkN2VjZTk5XkEyXkFqcGdeQXVyMjg0MTI5NzQ@._V1_UX67_CR0,0,67,98_AL_.jpg",tt1206572,12 Lotus,2008,121.0,Drama,5.8,,"Adored and revered singer Lian Hua seeks the acceptance of those she love. However, underneath the astonishing stage costumes, spot on choreography and sizable income, Lian Hua quite simply is a filial daughter and devoted girlfriend.",112,"[{'id': 'nm0848892', 'name': 'Royston Tan'}]","[{'id': 'nm2167218', 'name': 'Ling Ling Liu'}, {'id': 'nm2582146', 'name': 'Mindee Ong'}, {'id': 'nm1167123', 'name': 'Yuwu Qi'}, {'id': 'nm3105771', 'name': 'Fen Auntie'}]",cmn
"https://m.media-amazon.com/images/M/MV5BYjJjNjM5NjMtMjliMy00Y2EzLTg4YTYtMzVmYWM3YmJiOWE0XkEyXkFqcGdeQXVyMjg0MTI5NzQ@._V1_UY98_CR1,0,67,98_AL_.jpg",tt1232827,Ting che,2008,112.0,Drama,6.9,,"On Mother's Day in Taipei, Chen Mo makes a date for dinner with his wife, hoping to bring their estranged relationship back together. While buying a cake on his way home, a car unexpectedly...                See full summary »",723,"[{'id': 'nm3010935', 'name': 'Mong-Hong Chung'}]","[{'id': 'nm0151654', 'name': 'Chang Chen'}, {'id': 'nm1251565', 'name': 'Gwei Lun-Mei'}, {'id': 'nm0197240', 'name': 'Leon Dai'}, {'id': 'nm0864779', 'name': 'Chapman To'}]",cmn
"https://m.media-amazon.com/images/M/MV5BYmFiOWVkYTEtYTkxYS00NGI5LTlmNzAtNWRkZGExOTk0NDM3XkEyXkFqcGdeQXVyMzc0MDcxMA@@._V1_UX67_CR0,0,67,98_AL_.jpg",tt1173568,Slam,2008,93.0,"Action, Drama, Family",5.5,,"Our story begins on the last day of school during final exams in Beijing, China. Mouth, a shy insecure 15-year-old, and his best friend Monkey, an undersized energetic loudmouth, get ready ...                See full summary »",246,"[{'id': 'nm2587908', 'name': 'Jonathan Lim'}]","[{'id': 'nm2591248', 'name': 'Yishan Zhang'}, {'id': 'nm2898266', 'name': 'Andrew Chou'}, {'id': 'nm2900176', 'name': 'Xiaofan Lin'}, {'id': 'nm1837728', 'name': 'Wenqi Zhao'}]",cmn
"https://m.media-amazon.com/images/M/MV5BYTcyMDJiNjEtODQzZC00ZTMzLThjYzktNjdmNGRmMmY2ZjE1XkEyXkFqcGdeQXVyMjg0MTI5NzQ@._V1_UY98_CR1,0,67,98_AL_.jpg",tt1329469,1895,2008,110.0,History,5.8,,"""1895"" tells the story of the resistance against the Japanese invasion in 1895 (the biggest war in Taiwan's history). After the 1894 Sin-Japanese war, the Qing government ceded Taiwan to ...                See full summary »",162,"[{'id': 'nm0402181', 'name': 'Chih-Yu Hung'}]","[{'id': 'nm2437412', 'name': 'Sheng-hao Wen'}, {'id': 'nm1392367', 'name': 'Cheryl Yang'}, {'id': 'nm2432655', 'name': 'Josephine A. Blankstein'}, {'id': 'nm3214105', 'name': 'Bryan Shu-Hao Chang'}]",cmn
"https://m.media-amazon.com/images/M/MV5BYjc0YTA5N2EtNTdkYi00OTdkLWIwZTItZjdkYWMzYzRiNTc3XkEyXkFqcGdeQXVyMjg0MTI5NzQ@._V1_UX67_CR0,0,67,98_AL_.jpg",tt1182615,Lao shi jia lao da,2008,158.0,Comedy,4.9,,"Light-hearted black comedy about a young lady, Wang Li hua (Fann Wong) tries to restructure her money-lending triad into a professional and 'loving' triad that stands against the use of ...                See full summary »",203,"[{'id': 'nm0626090', 'name': 'Jack Neo'}]","[{'id': 'nm0939056', 'name': 'Fann Wong'}, {'id': 'nm0497834', 'name': 'Mark Lee'}, {'id': 'nm0998976', 'name': 'Richard Low'}, {'id': 'nm3003731', 'name': 'Jack Lim'}]",cmn
"https://m.media-amazon.com/images/M/MV5BZmJkOWM4M2ItYzk1ZS00MDYyLTlmMWUtYjk3M2I5ODFmNjZjXkEyXkFqcGdeQXVyMzc1NTUwNjM@._V1_UX67_CR0,0,67,98_AL_.jpg",tt1087906,Ying han,2008,95.0,"Crime, Drama",6.1,,"Lao San is a young veteran high in Kungfu power but low in intelligence. After landing on a job as a body guard for a wealthy antique collector, Lao San finds out his boss's plot to rob the National Art Museum.",495,"[{'id': 'nm0227625', 'name': 'Sheng Ding'}]","[{'id': 'nm1091782', 'name': 'Ye Liu'}, {'id': 'nm0938893', 'name': 'Anthony Chau-Sang Wong'}, {'id': 'nm0949173', 'name': 'Yong You'}, {'id': 'nm2594200', 'name': 'Yang Liu'}]",cmn
"https://m.media-amazon.com/images/M/MV5BNzM4NDJiOWEtMWJjMS00NTBmLTgzZWEtOGNkMjM5ZWJmMWNkXkEyXkFqcGdeQXVyMjg0MTI5NzQ@._V1_UY98_CR1,0,67,98_AL_.jpg",tt1037146,Nu ren bu huai,2008,120.0,"Comedy, Romance",5.2,,A series of intertwining stories focus on the lives and transformations of three women.,501,"[{'id': 'nm0007139', 'name': 'Hark Tsui'}]","[{'id': 'nm0955782', 'name': 'Xun Zhou'}, {'id': 'nm1251565', 'name': 'Gwei Lun-Mei'}, {'id': 'nm2514879', 'name': 'Yuqi Zhang'}, {'id': 'nm0298691', 'name': 'Stephen Fung'}]",cmn
"https://m.media-amazon.com/images/M/MV5BYTMzNmQ4MTgtOTZmMC00NTRiLWE3YjQtNzFiZTFmZmUwZTE2XkEyXkFqcGdeQXVyMjExMzEyNTM@._V1_UY98_CR1,0,67,98_AL_.jpg",tt1000775,Shuang shi ji,2008,98.0,"Drama, Mystery, Thriller",6.2,,A mystery about a gourmet in love with two different women who winds up poisoned.,329,"[{'id': 'nm2800789', 'name': 'Tianyu Zhao'}]","[{'id': 'nm0628757', 'name': 'Francis Ng'}, {'id': 'nm0950544', 'name': 'Nan Yu'}, {'id': 'nm2798295', 'name': 'Yiyan Jiang'}, {'id': 'nm3185241', 'name': 'Yuchen Zhu'}]",cmn
"https://m.media-amazon.com/images/M/MV5BOTFhZGM1MWEtYzI0Yy00MjRlLWIxZjMtODA1NTMyYzIwNzU4XkEyXkFqcGdeQXVyMjQwMjk0NjI@._V1_UY98_CR1,0,67,98_AL_.jpg",tt1252557,Hua chi le na nv hai,2008,106.0,Romance,5.5,,"Four separate vignettes about lesbian relationships and dating, ending with a summation about relationships.",343,"[{'id': 'nm3056656', 'name': 'Hung-i Chen'}]","[{'id': 'nm2432655', 'name': 'Josephine A. Blankstein'}, {'id': 'nm3056442', 'name': 'Cheer Chen'}, {'id': 'nm3057770', 'name': 'Yang-kun Chen'}, {'id': 'nm3055730', 'name': 'Belle Hsin'}]",cmn
"https://m.media-amazon.com/images/M/MV5BNjIwMDNiMmItYjhmOS00MWFlLTk3MDktM2VhMTQ2YjhjZTE4XkEyXkFqcGdeQXVyMjg0MTI5NzQ@._V1_UY98_CR1,0,67,98_AL_.jpg",tt1289802,Jiong nan hai,2008,104.0,"Comedy, Drama, Fantasy",7.2,,"They're more than just naughty: they play tricks on classmates, tease girls at school, fight with other boys, and lie to everyone until their teacher breaks down. They are called Liar No. 1...                See full summary »",486,"[{'id': 'nm3127578', 'name': 'Ya-che Yang'}]","[{'id': 'nm3818786', 'name': 'Bamboo Chu-Sheng Chen'}, {'id': 'nm6035089', 'name': 'Ching-Ssu Hsieh'}, {'id': 'nm3128084', 'name': 'Chi-wen Hsu'}, {'id': 'nm3128062', 'name': 'Kuan-yi Lee'}]",cmn
"https://m.media-amazon.com/images/M/MV5BMTQ2Mjg1OTE4OF5BMl5BanBnXkFtZTgwMDM0ODgwODE@._V1_UY98_CR3,0,67,98_AL_.jpg",tt1307008,Ji ri qi cheng,2008,100.0,"Action, Comedy, Crime",6.3,,"Lao Cui has returned to China to finalize his divorce, on his way to the airport to go back to Cyprus he accidentally stumbles into a drunken girl named Xiao Xia on the run from some bad ...                See full summary »",287,"[{'id': 'nm0514950', 'name': 'Jiang Liu'}]","[{'id': 'nm1981215', 'name': 'Wei Fan'}, {'id': 'nm3224989', 'name': 'Wenpei Ju'}, {'id': 'nm2348667', 'name': 'Hua Liu'}, {'id': 'nm3511805', 'name': 'Qianyuan Wang'}]",cmn
"https://m.media-amazon.com/images/M/MV5BOWUyYzRjNTctODE5OS00YWQ1LWE3NjMtNzQ3OTM0YjQwNWFlXkEyXkFqcGdeQXVyMjg0MTI5NzQ@._V1_UX67_CR0,0,67,98_AL_.jpg",tt1329101,Ai de fa sheng lian xi,2008,120.0,Romance,4.8,,"Kitty desperately seeks true love, sometimes foolishly. She runs into her biological mother, only to discover her step father is a peeping-Tom. She elopes with her classmate A Liang, but ...                See full summary »",233,"[{'id': 'nm3208940', 'name': 'Leading Li'}]","[{'id': 'nm2074459', 'name': 'Barbie Hsu'}, {'id': 'nm2108643', 'name': 'Eddie Peng'}, {'id': 'nm1534398', 'name': 'Hsiao-chuan Chang'}, {'id': 'nm2612459', 'name': 'Ming-hsiang Tung'}]",cmn
"https://m.media-amazon.com/images/M/MV5BMTM2NjlmMzMtOTJiYy00Njg0LTlmNzAtMzk0NDJmNzMzZDM2XkEyXkFqcGdeQXVyNTkxMTA1NTM@._V1_UY98_CR0,0,67,98_AL_.jpg",tt1978472,Er duo da you fu,2008,96.0,"Comedy, Drama, Family",7.2,,"Set in a small town, Northeast China. Big-ear Wang Kangmei retires from work. He has tracheopathia, his wife also stays in hospital for illness, the son ignores proper occupation, the ...                See full summary »",105,"[{'id': 'nm4070848', 'name': 'Meng Zhang'}]","[{'id': 'nm1981215', 'name': 'Wei Fan'}, {'id': 'nm4528705', 'name': 'Shubo Cheng'}, {'id': 'nm1278099', 'name': 'Jibo Zhang'}]",cmn
"https://m.media-amazon.com/images/M/MV5BMjAwNDZlNWMtOTI0Yy00ZGE4LTk2NjgtZGZjZTM0MzQ4NzJhXkEyXkFqcGdeQXVyMjE4MTIyNDI@._V1_UY98_CR1,0,67,98_AL_.jpg",tt1379186,Luan qing chun,2008,98.0,"Drama, Romance",5.6,,Add a Plot,102,"[{'id': 'nm0496995', 'name': 'Chi-Yuarn Lee'}]","[{'id': 'nm3318135', 'name': 'Amiya Lee'}, {'id': 'nm3318905', 'name': 'Yi-Chiao Liao'}, {'id': 'nm3311713', 'name': 'Angel Yao'}]",cmn
"https://m.media-amazon.com/images/M/MV5BMGEyYjA1M2EtNWI2Zi00ODRlLWI5NmUtOWQ4ZTlkMGRlYjdhXkEyXkFqcGdeQXVyMjg0MTI5NzQ@._V1_UY98_CR0,0,67,98_AL_.jpg",tt1156136,Hu die fei,2008,88.0,"Drama, Romance",4.8,,"A woman is revisited by the ghost of her ex-boyfriend, three years after a car crash took his life.",293,"[{'id': 'nm0864775', 'name': 'Johnnie To'}]","[{'id': 'nm1438366', 'name': 'Vic Chou'}, {'id': 'nm0508356', 'name': 'Bingbing Li'}, {'id': 'nm0803308', 'name': 'Maggie Siu'}, {'id': 'nm0482695', 'name': 'Suet Lam'}]",cmn
"https://m.media-amazon.com/images/M/MV5BYmIzNGMzODEtZDk2NC00MzgwLTk4ZDQtMTE5ZGVjNjMxMjk5XkEyXkFqcGdeQXVyMjg0MTI5NzQ@._V1_UY98_CR2,0,67,98_AL_.jpg",tt1194582,Faa faa ying ging,2008,98.0,"Action, Romance, Thriller",5.0,,"Two off-the-wall detectives go in search for a killer, while vying for the affections of a young woman.",374,"[{'id': 'nm0155598', 'name': 'Jingle Ma'}]","[{'id': 'nm1284845', 'name': 'Shawn Yue'}, {'id': 'nm1179512', 'name': 'Kun Chen'}, {'id': 'nm1273177', 'name': 'Shaun Tam'}, {'id': 'nm2351640', 'name': 'Linda Chung'}]",cmn
"https://m.media-amazon.com/images/M/MV5BYTA0Mzk1ZTgtODYxZS00MDA1LWExYjAtYWJhZjAwYmNlMDJmXkEyXkFqcGdeQXVyMjg0MTI5NzQ@._V1_UY98_CR1,0,67,98_AL_.jpg",tt1180323,Wo jiao Liu Yue Jin,2008,85.0,Drama,6.4,,Add a Plot,156,"[{'id': 'nm2167709', 'name': 'Liwen Ma'}]","[{'id': 'nm1901307', 'name': 'Jin Chen'}, {'id': 'nm3211216', 'name': 'Zhicheng Ding'}, {'id': 'nm2216896', 'name': 'Jun Guo'}, {'id': 'nm8281408', 'name': 'Henan Li'}]",cmn
"https://m.media-amazon.com/images/M/MV5BNzRmNWU0ZGMtODRkNS00ZmU4LTljZTItNWUyZWI2Mjc0NDZmXkEyXkFqcGdeQXVyMDc4NjY0NQ@@._V1_UY98_CR1,0,67,98_AL_.jpg",tt1201637,Mi guo,2008,100.0,Drama,6.5,,The relationship between a teenage son and his mother become complicated when they take in secretive young woman into their home.,218,"[{'id': 'nm1403892', 'name': 'Yibai Zhang'}]","[{'id': 'nm0596297', 'name': 'Karen Mok'}, {'id': 'nm0422639', 'name': 'Wenli Jiang'}, {'id': 'nm0150873', 'name': 'Eason Chan'}, {'id': 'nm3167599', 'name': 'Bowen Duan'}]",cmn
"https://m.media-amazon.com/images/M/MV5BODNiYjk4ZjEtNmJjYi00ZWE4LTllYmQtODkzZDY1MDYzMDY4XkEyXkFqcGdeQXVyMjg0MTI5NzQ@._V1_UY98_CR0,0,67,98_AL_.jpg",tt1265647,Dan. Dao,2008,95.0,"Action, History, Thriller",5.9,,Add a Plot,104,"[{'id': 'nm0013828', 'name': 'Lawrence Ah-Mon'}]","[{'id': 'nm0945189', 'name': 'Simon Yam'}, {'id': 'nm1534398', 'name': 'Hsiao-chuan Chang'}, {'id': 'nm2954284', 'name': 'Kai-Syuan Tzeng'}, {'id': 'nm0359217', 'name': 'Han Chang'}]",cmn
"https://m.media-amazon.com/images/M/MV5BODhhMjAyMDMtMjkyNC00ODY3LTk3OWMtNThhMjU4ZThjNjU5XkEyXkFqcGdeQXVyMjExMzEyNTM@._V1_UY98_CR1,0,67,98_AL_.jpg",tt1314247,Tao hua yun,2008,115.0,"Comedy, Drama, Romance",5.2,,Add a Plot,223,"[{'id': 'nm2167709', 'name': 'Liwen Ma'}]","[{'id': 'nm0311212', 'name': 'You Ge'}, {'id': 'nm0943180', 'name': 'Vivian Wu'}, {'id': 'nm0849919', 'name': 'Tao Guo'}, {'id': 'nm3210985', 'name': 'Xibei Chen'}]",cmn
"https://m.media-amazon.com/images/M/MV5BNDM5YTZjOGQtMDUwOC00MTkyLWIzMTYtYmMyM2JkY2UyMjEyXkEyXkFqcGdeQXVyMjQ2MTk1OTE@._V1_UY98_CR1,0,67,98_AL_.jpg",tt0445760,Tian bian yi duo yun,2005,114.0,"Comedy, Drama, Musical",6.5,45,"Hsiao-Kang, now working as a pornographic actor, meets Shiang-chyi once again. Meanwhile, the city of Taipei faces a water shortage that makes the sales of watermelons skyrocket.",5481,"[{'id': 'nm0158857', 'name': 'Ming-liang Tsai'}]","[{'id': 'nm0497642', 'name': 'Kang-sheng Lee'}, {'id': 'nm0155365', 'name': 'Shiang-chyi Chen'}, {'id': 'nm0523717', 'name': 'Yi-Ching Lu'}, {'id': 'nm0945992', 'name': 'Kuei-Mei Yang'}]",cmn
"https://m.media-amazon.com/images/M/MV5BOTZhYThkMTAtYjk0Mi00OTg4LTljMzQtMWE1NTM3NjdkM2RjXkEyXkFqcGdeQXVyNzI1NzMxNzM@._V1_UY98_CR0,0,67,98_AL_.jpg",tt0459666,Zui hao de shi guang,2005,139.0,"Drama, Romance",6.9,82,"Three stories set in three times, 1911, 1966 and 2005. Two actors play the two main characters in each story.",6038,"[{'id': 'nm0396284', 'name': 'Hsiao-Hsien Hou'}]","[{'id': 'nm0795517', 'name': 'Shu Qi'}, {'id': 'nm0151654', 'name': 'Chang Chen'}, {'id': 'nm2007323', 'name': 'Fang Mei'}, {'id': 'nm0796054', 'name': 'Shu-Chen Liao'}]",cmn
"https://m.media-amazon.com/images/M/MV5BOTYxYzExYjEtODJkNC00NTBkLWE0YmMtOWIxMTk1ZWVhYTcwXkEyXkFqcGdeQXVyNzI1NzMxNzM@._V1_UY98_CR0,0,67,98_AL_.jpg",tt0365847,San wa,2005,122.0,"Action, Adventure, Comedy",6.1,,"Archeologist Jack keeps having reoccurring dreams of a past life, where he is the great general Meng Yi, who is sworn to protect a princess named Ok-Soo. Jack decides to go investigate everything with his friend William.",15954,"[{'id': 'nm0867262', 'name': 'Stanley Tong'}]","[{'id': 'nm0788405', 'name': 'Bing Shao'}, {'id': 'nm0000329', 'name': 'Jackie Chan'}, {'id': 'nm2274407', 'name': 'Weixing Yao'}, {'id': 'nm2848532', 'name': 'Jianzhong Zhang'}]",cmn
"https://m.media-amazon.com/images/M/MV5BN2FmYjRjZGEtZGYxZi00YjY1LWI4ZTktNmMzMTg5OWFjMWQ2L2ltYWdlXkEyXkFqcGdeQXVyMjgyNjk3MzE@._V1_UY98_CR1,0,67,98_AL_.jpg",tt0411098,All the Invisible Children,2005,124.0,Drama,7.4,,"Through the plights of seven different children, seven cruel destinies unfold, as the unknown innocents who share the same sensitivities and desires struggle for survival, understanding--and above all--love, in an apathetic grown-up world.",4199,"[{'id': 'nm0000247', 'name': 'John Woo'}, {'id': 'nm0893034', 'name': 'Stefano Veneruso'}, {'id': 'nm0000631', 'name': 'Ridley Scott'}, {'id': 'nm0779386', 'name': 'Jordan Scott'}, {'id': 'nm0526199', 'name': 'Kátia Lund'}, {'id': 'nm0000490', 'name': 'Spike Lee'}, {'id': 'nm0001437', 'name': 'Emir Kusturica'}, {'id': 'nm0152831', 'name': 'Mehdi Charef'}]","[{'id': 'nm2304645', 'name': 'Adama Bila'}, {'id': 'nm2307392', 'name': 'Elysée Rouamba'}, {'id': 'nm2312057', 'name': 'Rodrigue Ouattara'}, {'id': 'nm2310452', 'name': 'Uros Milovanovic'}]",cmn
"https://m.media-amazon.com/images/M/MV5BY2UxNTEwMGYtYWIzMC00ZTE1LWE1YmUtNzhjOGM0YWE5NTgxXkEyXkFqcGdeQXVyMjg0MTI5NzQ@._V1_UY98_CR1,0,67,98_AL_.jpg",tt0429078,Qi jian,2005,153.0,"Action, Adventure, Fantasy",6.1,,Seven warriors come together to protect a village from a diabolical General.,9810,"[{'id': 'nm0007139', 'name': 'Hark Tsui'}]","[{'id': 'nm0481709', 'name': 'Leon Lai'}, {'id': 'nm0947447', 'name': 'Donnie Yen'}, {'id': 'nm0947777', 'name': 'Charlie Yeung'}, {'id': 'nm0838944', 'name': 'Honglei Sun'}]",cmn
"https://m.media-amazon.com/images/M/MV5BMmIzOGU3NDMtOTk1My00MDI5LWE3MzMtNDE4ZTk0ODUwNTM3XkEyXkFqcGdeQXVyNzI1NzMxNzM@._V1_UX67_CR0,0,67,98_AL_.jpg",tt0417976,Wu ji,2005,121.0,"Action, Drama, Fantasy",5.6,53,"Empowered by the love of a slave (Jang), a royal concubine (Cheung) is given the chance to make an extraordinary decision.",9387,"[{'id': 'nm0155280', 'name': 'Kaige Chen'}]","[{'id': 'nm0156444', 'name': 'Cecilia Cheung'}, {'id': 'nm0417520', 'name': 'Jang Dong-Gun'}, {'id': 'nm0760796', 'name': 'Hiroyuki Sanada'}, {'id': 'nm0874866', 'name': 'Nicholas Tse'}]",cmn
"https://m.media-amazon.com/images/M/MV5BZmZhOWZmNmYtZWYzOS00ZDQxLTk1YzEtZGNlNDljNjM1MDdjXkEyXkFqcGdeQXVyMjg0MTI5NzQ@._V1_UY98_CR0,0,67,98_AL_.jpg",tt0454914,Ru guo · Ai,2005,108.0,"Drama, Musical, Romance",6.8,,A love triangle develops during the making of a musical in mainland China.,2632,"[{'id': 'nm0151066', 'name': 'Peter Ho-Sun Chan'}]","[{'id': 'nm0437580', 'name': 'Takeshi Kaneshiro'}, {'id': 'nm0955782', 'name': 'Xun Zhou'}, {'id': 'nm0156484', 'name': 'Jacky Cheung'}, {'id': 'nm1097536', 'name': 'Jin-hee Ji'}]",cmn
"https://m.media-amazon.com/images/M/MV5BOTFjNzMwYzEtMjcwOC00N2E5LTg0YWYtZWE1MDVjODE4YTYyL2ltYWdlXkEyXkFqcGdeQXVyNTAyODkwOQ@@._V1_UY98_CR0,0,67,98_AL_.jpg",tt0437447,Qian li zou dan qi,2005,107.0,Drama,7.3,73,A Japanese father travels to China's Yunnan province in the place of his ailing son to film a folk-opera singer.,5533,"[{'id': 'nm0955443', 'name': 'Yimou Zhang'}]","[{'id': 'nm0847264', 'name': 'Ken Takakura'}, {'id': 'nm0620018', 'name': 'Kiichi Nakai'}, {'id': 'nm0855429', 'name': 'Shinobu Terajima'}, {'id': 'nm1066120', 'name': 'Ken Nakamoto'}]",cmn
"https://m.media-amazon.com/images/M/MV5BNzI2NjkxNzQyMV5BMl5BanBnXkFtZTcwMjc1MTgyMQ@@._V1_UY98_CR4,0,67,98_AL_.jpg",tt0267024,Thru the Moebius Strip,2005,87.0,"Animation, Adventure, Sci-Fi",5.1,,"In the not-too-distant future, a young boy travels to an alien world to find his father and learn of his destiny.",587,"[{'id': 'nm0149665', 'name': 'Glenn Chaika'}]","[{'id': 'nm0001795', 'name': 'Jonathan Taylor Thomas'}, {'id': 'nm0549815', 'name': 'Christopher Marquette'}, {'id': 'nm0000434', 'name': 'Mark Hamill'}, {'id': 'nm0000373', 'name': 'Michael Dorn'}]",cmn
"https://m.media-amazon.com/images/M/MV5BYTNiZGYwNmQtNzg2Yy00MDQ2LWFjZDYtM2EyYWE0YTBlYzE4XkEyXkFqcGdeQXVyMjg0MTI5NzQ@._V1_UY98_CR1,0,67,98_AL_.jpg",tt0475263,Chang hen ge,2005,115.0,"Drama, Romance",5.6,,"A person's life is destined to be shorter than that of a city. Having spent her whole life in Shanghai, Qiyao has her moments of prosperity and her fair share of loneliness. She finally ...                See full summary »",464,"[{'id': 'nm0477102', 'name': 'Stanley Kwan'}]","[{'id': 'nm0155618', 'name': 'Sammi Cheng'}, {'id': 'nm0504899', 'name': 'Tony Ka Fai Leung'}, {'id': 'nm0432425', 'name': 'Jun Hu'}, {'id': 'nm0943079', 'name': 'Daniel Wu'}]",cmn
"https://m.media-amazon.com/images/M/MV5BNTdkYTA0NGUtZDY4OC00YzJiLWE5YjgtZDNhYTkyN2NmNmYwXkEyXkFqcGdeQXVyMTY5Nzc4MDY@._V1_UY98_CR5,0,67,98_AL_.jpg",tt0467506,Zhai bian,2005,97.0,"Drama, Horror",5.1,,"A Taiwanese man returns to the island after years abroad when he inherits a house. When he and his fiancé move in, strange things start to happen.",816,"[{'id': 'nm1970591', 'name': 'Leste Chen'}]","[{'id': 'nm1446980', 'name': 'Terri Kwan'}, {'id': 'nm1677643', 'name': 'Jason Chang'}, {'id': 'nm1966190', 'name': 'Chia-Hui Chang'}, {'id': 'nm1968180', 'name': 'Tender Huang'}]",cmn
"https://m.media-amazon.com/images/M/MV5BMTI0ODg3ODg1Nl5BMl5BanBnXkFtZTcwOTA1Nzk0MQ@@._V1_UY98_CR1,0,67,98_AL_.jpg",tt0448989,American Fusion,2005,94.0,"Comedy, Romance",6.2,,"If you thought your family was nuts, wait until you meet this Chinese-American clan! Traditional Grandma tries to rule the roost, but her children and grandchildren have ideas of their own.",187,"[{'id': 'nm1860624', 'name': 'Frank Lin'}]","[{'id': 'nm0151827', 'name': 'Sylvia Chang'}, {'id': 'nm0005246', 'name': 'Esai Morales'}, {'id': 'nm0628877', 'name': 'Collin Chou'}, {'id': 'nm0950915', 'name': 'Lang Yun'}]",cmn
"https://m.media-amazon.com/images/M/MV5BN2ExNjNkODktMjc3Mi00OTQ0LThkMDEtNzY1NWRhOGQxYTlkXkEyXkFqcGdeQXVyMjg0MTI5NzQ@._V1_UY98_CR1,0,67,98_AL_.jpg",tt0485656,Gu lian hua,2005,108.0,"Drama, Romance",7.0,,A woman's lesbian feeling towards two different female singers - one in Shanghai during late 1940s and another in Taiwan during late 1950s.,102,"[{'id': 'nm2076015', 'name': 'Jui-Yuan Tsao'}]","[{'id': 'nm0950703', 'name': 'Anita Yuen'}, {'id': 'nm0496806', 'name': 'Angelica Lee'}, {'id': 'nm0398764', 'name': 'Shu-shen Hsiao'}, {'id': 'nm0849916', 'name': 'Tsung-Hua Tou'}]",cmn
"https://m.media-amazon.com/images/M/MV5BYjExNWZmN2YtNzExMC00MmQ4LTkyNTUtZWJmNjMyN2M0NTU2XkEyXkFqcGdeQXVyMjg0MTI5NzQ@._V1_UY98_CR1,0,67,98_AL_.jpg",tt0445506,Kong que,2005,136.0,Drama,7.6,,China in the late 1970s and early 1980s: the life of an ordinary working family as seen through its three siblings.,1098,"[{'id': 'nm0345146', 'name': 'Changwei Gu'}]","[{'id': 'nm1880245', 'name': 'Jing An'}, {'id': 'nm1828940', 'name': 'Li Feng'}, {'id': 'nm0345146', 'name': 'Changwei Gu'}, {'id': 'nm1287505', 'name': 'Meiying Huang'}]",cmn
"https://m.media-amazon.com/images/M/MV5BNzAyYTgzZjktODVjNy00NGI0LTg3ZGItYjY1YTUxOWFlYjc2XkEyXkFqcGdeQXVyNDg5Mzk5Mg@@._V1_UY98_CR1,0,67,98_AL_.jpg",tt0450099,Qing ren jie,2005,113.0,"Drama, Romance",6.4,,"A love story that should not have happened. But the Great Cultural Revolution fathered it. As memorable as Romeo and Juliet, their love tied with the same intrusion from their families ¨C ...                See full summary »",389,"[{'id': 'nm0403225', 'name': 'Jianqi Huo'}]","[{'id': 'nm0955505', 'name': 'Wei Zhao'}, {'id': 'nm1254646', 'name': 'Yi Lu'}, {'id': 'nm2137901', 'name': 'Minjie Cui'}, {'id': 'nm2141907', 'name': 'Yujia Ding'}]",cmn
"https://m.media-amazon.com/images/M/MV5BZWRkZTEwZTItZDY3MS00Y2M0LTk5MzItNTA5ZjBiOTYwNzczXkEyXkFqcGdeQXVyMjQ2MTk1OTE@._V1_UY98_CR3,0,67,98_AL_.jpg",tt0456658,Qing hong,2005,123.0,Drama,7.0,,"In the 1980s, encouraged by the government, a large number of families leave Chinese cities to settle in the poorer regions of the country, in order to develop local industry. The film's ...                See full summary »",1175,"[{'id': 'nm0911075', 'name': 'Xiaoshuai Wang'}]","[{'id': 'nm0304729', 'name': 'Yuanyuan Gao'}, {'id': 'nm1222856', 'name': 'Bin Li'}, {'id': 'nm2290954', 'name': 'Hao Qin'}, {'id': 'nm1443576', 'name': 'Yang Tang'}]",cmn
"https://m.media-amazon.com/images/M/MV5BMjEyMDk0MzMxOF5BMl5BanBnXkFtZTcwNTE2NDM3MQ@@._V1_UY98_CR2,0,67,98_AL_.jpg",tt0401808,Xiang ri kui,2005,129.0,"Drama, Romance",7.2,64,"Relationship between father and son on a background of Maoist regime in China in the mid-20th century. The father, a painter by profession, interned in a labor camp for ""re-education"" and ...                See full summary »",715,"[{'id': 'nm0955434', 'name': 'Yang Zhang'}]","[{'id': 'nm0001040', 'name': 'Joan Chen'}, {'id': 'nm2050065', 'name': 'Zhang Fan'}, {'id': 'nm2005211', 'name': 'Ge Gao'}, {'id': 'nm1222856', 'name': 'Bin Li'}]",cmn
"https://m.media-amazon.com/images/M/MV5BMTc5NTQ5Nzc0OF5BMl5BanBnXkFtZTgwOTg2MDA2MDE@._V1_UX67_CR0,0,67,98_AL_.jpg",tt0477719,Hong yan,2005,93.0,Drama,6.9,,"Loneliness, saving face, and public mores. In 1983 in China, Yun is a bright schoolgirl who gets pregnant. She's expelled, her boyfriend leaves town, and her mother arranges the baby's ...                See full summary »",305,"[{'id': 'nm1165953', 'name': 'Yu Li'}]","[{'id': 'nm2030322', 'name': 'Xingrao Huang'}, {'id': 'nm1280128', 'name': 'Kechun Li'}, {'id': 'nm0515051', 'name': 'Yi Liu'}, {'id': 'nm2029948', 'name': 'Yizhu Wang'}]",cmn
