poster,imdb-id,title,release-year,runtime,genre,imdb-rating,metascore,overview,votes,directors,cast,language
"https://m.media-amazon.com/images/M/MV5BMjE4NjU3MTE0NF5BMl5BanBnXkFtZTgwODk2NjI2MDE@._V1_UX67_CR0,0,67,98_AL_.jpg",tt2204340,Si da ming bu,2012,118.0,"Action, Crime, Fantasy",5.7,,"A government department known as the Six Panels appoints their best officer to infiltrate a special force called the Divine Constabulary, to ensure their way in stopping the circulation of counterfeit coin currency in the capital.",2397,"[{'id': 'nm0150929', 'name': 'Janet Chun'}, {'id': 'nm0150906', 'name': 'Gordon Chan'}]","[{'id': 'nm2874732', 'name': 'Chao Deng'}, {'id': 'nm1703577', 'name': 'Liu Yifei'}, {'id': 'nm0155617', 'name': 'Ronald Cheng'}, {'id': 'nm0628877', 'name': 'Collin Chou'}]",cmn
"https://m.media-amazon.com/images/M/MV5BMTk4ODg3OTQ5MV5BMl5BanBnXkFtZTgwMzYwNzk4MDE@._V1_UY98_CR1,0,67,98_AL_.jpg",tt2458314,Da Shang Hai,2012,107.0,"Action, Adventure, Crime",6.5,,"Action superstar Chow Yun-Fat portrays real-life gangster Chen Daqi as he rises to the upper echelons of power, finding himself torn between the love of two women, the murderous plots of the secret service, and the looming threat of war.",2079,"[{'id': 'nm0939147', 'name': 'Jing Wong'}]","[{'id': 'nm0000334', 'name': 'Chow Yun-Fat'}, {'id': 'nm2119781', 'name': 'Xiaoming Huang'}, {'id': 'nm0005033', 'name': 'Sammo Kam-Bo Hung'}, {'id': 'nm0628757', 'name': 'Francis Ng'}]",cmn
"https://m.media-amazon.com/images/M/MV5BMjI4OTkzMTUxMV5BMl5BanBnXkFtZTgwNzU1NzIwMTE@._V1_UY98_CR1,0,67,98_AL_.jpg",tt2459022,Ren zai jiong tu: Tai jiong,2012,105.0,"Adventure, Comedy, Drama",6.2,55,"On a wild road trip, three men find inner peace in the city that never sleeps.",3702,"[{'id': 'nm1905770', 'name': 'Zheng Xu'}]","[{'id': 'nm1905770', 'name': 'Zheng Xu'}, {'id': 'nm1316170', 'name': 'Baoqiang Wang'}, {'id': 'nm2348646', 'name': 'Bo Huang'}, {'id': 'nm0849920', 'name': 'Hong Tao'}]",cmn
"https://m.media-amazon.com/images/M/MV5BZTE2MjU4Y2YtNzA3Mi00NWU4LWFhOWMtZmNhYjFiM2ZlMGY1XkEyXkFqcGdeQXVyNzI1NzMxNzM@._V1_UY98_CR2,0,67,98_AL_.jpg",tt2369127,Fu cheng mi shi,2012,98.0,"Crime, Drama",6.4,,"Lu Jie is having coffee with her desperate friend Sang Qi, who believes her husband is cheating on her. At the same time at a hotel across the road from the coffee shop, Lu Jie sees her ...                See full summary »",1275,"[{'id': 'nm0521601', 'name': 'Ye Lou'}]","[{'id': 'nm1165040', 'name': 'Lei Hao'}, {'id': 'nm2290954', 'name': 'Hao Qin'}, {'id': 'nm5035471', 'name': 'Xi Qi'}, {'id': 'nm3422245', 'name': 'Feng Zu'}]",cmn
"https://m.media-amazon.com/images/M/MV5BOThhNGVjOGItMjE0ZC00MGM4LWFkOGUtNDVmNGZlZjY5ODY0XkEyXkFqcGdeQXVyMjg0MTI5NzQ@._V1_UY98_CR1,0,67,98_AL_.jpg",tt2078768,Ting feng zhe,2012,120.0,"Crime, Drama, Mystery",6.2,,"An espionage thriller set in the 1950s and adapted from the novel ""Year Suan/Plot Against"" by May Jia. Tony Leung Chiu Wai plays a blind man who works for a piano tuner. He is recruited for a spy mission because of his exceptional hearing.",1731,"[{'id': 'nm0538320', 'name': 'Alan Mak'}, {'id': 'nm0159039', 'name': 'Felix Chong'}]","[{'id': 'nm0504897', 'name': 'Tony Leung Chiu-wai'}, {'id': 'nm0955782', 'name': 'Xun Zhou'}, {'id': 'nm1296571', 'name': 'Xuebing Wang'}, {'id': 'nm0266651', 'name': 'Mavis Fan'}]",cmn
"https://m.media-amazon.com/images/M/MV5BMjAzMzU0OTA1Nl5BMl5BanBnXkFtZTgwNjU5Mzg5MDE@._V1_UX67_CR0,0,67,98_AL_.jpg",tt3433170,The King of the Streets,2012,88.0,Action,5.0,,"Killing a competitor in a brutal street fight, Yue Feng is sent to prison for eight years. Upon his release, Yue works to fit back into society. But his dark past makes redemption a difficult, and possibly violent, road.",469,"[{'id': 'nm3612638', 'name': 'Yue Song'}, {'id': 'nm6184061', 'name': 'Zhong Lei'}]","[{'id': 'nm6184065', 'name': 'Kang En'}, {'id': 'nm6184062', 'name': 'Yang JunPing'}, {'id': 'nm6184067', 'name': 'Becki Li'}, {'id': 'nm6184066', 'name': 'Changhai Li'}]",cmn
"https://m.media-amazon.com/images/M/MV5BZDRlNWZhYjEtNTY5Yy00YjVjLThiNjgtYTA0YTNiYWQ1YjFlXkEyXkFqcGdeQXVyMjg0MTI5NzQ@._V1_UY98_CR1,0,67,98_AL_.jpg",tt2296692,Di yi ci,2012,106.0,"Drama, Romance",6.5,,"About Shiqiao, a girl who suffers from a neuromuscular disease but always dreamed of being a ballet dancer. She meets Gong, a boy who have a family problem because they are against his dream to become a rock band singer.",486,"[{'id': 'nm5181204', 'name': 'Yan Han'}]","[{'id': 'nm3609766', 'name': 'Mark Chao'}, {'id': 'nm2854802', 'name': 'Angelababy'}, {'id': 'nm1308995', 'name': 'Shan Jiang'}, {'id': 'nm4378961', 'name': 'Shu-Hai Chao'}]",cmn
"https://m.media-amazon.com/images/M/MV5BNTFjYjhlMjYtMGFmYS00MGU0LTg4ZTMtMTMzOGQ4YjMwODcwXkEyXkFqcGdeQXVyMTMxMTY0OTQ@._V1_UX67_CR0,0,67,98_AL_.jpg",tt1919137,Wang de Shengyan,2012,120.0,"Action, History",5.8,,The story of two warring generals (Liu Bang and Xiang Yu) fighting for control of China at the end of the Qin Dynasty.,888,"[{'id': 'nm1283651', 'name': 'Chuan Lu'}]","[{'id': 'nm1091782', 'name': 'Ye Liu'}, {'id': 'nm0943079', 'name': 'Daniel Wu'}, {'id': 'nm0151654', 'name': 'Chang Chen'}, {'id': 'nm3382120', 'name': 'Lan Qin'}]",cmn
"https://m.media-amazon.com/images/M/MV5BZWFkMDJiODYtY2I1OS00ZTBhLWEzZjYtMGUyMjhjYjhhMTc5XkEyXkFqcGdeQXVyNzI1NzMxNzM@._V1_UY98_CR2,0,67,98_AL_.jpg",tt1847713,Xue di zi,2012,112.0,"Action, Drama",4.8,35,An elite crime-fighting unit in the court of the Chinese emperor relies on flying swords to defeat their enemies.,1409,"[{'id': 'nm0490487', 'name': 'Andrew Lau'}]","[{'id': 'nm2119781', 'name': 'Xiaoming Huang'}, {'id': 'nm2432722', 'name': 'Ethan Juan'}, {'id': 'nm2460813', 'name': 'Purba Rgyal'}, {'id': 'nm4526249', 'name': 'Tian Gao'}]",cmn
"https://m.media-amazon.com/images/M/MV5BMTQxNTcxNjQyN15BMl5BanBnXkFtZTgwMDE5MzAwMjE@._V1_UY98_CR1,0,67,98_AL_.jpg",tt2400407,Pi fu,2012,105.0,"Drama, History",5.4,,The movie is set during the Japanese invasion of China. The story is told from the perspective of Gao - a soldier seeking revenge from the Japanese. He is trying to assassinate the visiting...                See full summary »,216,"[{'id': 'nm3632031', 'name': 'Shu-peng Yang'}]","[{'id': 'nm2119781', 'name': 'Xiaoming Huang'}, {'id': 'nm3589263', 'name': 'Yi Zhang'}, {'id': 'nm3279025', 'name': 'Xinyi Zhang'}, {'id': 'nm5052746', 'name': 'Jingyang Ni'}]",cmn
"https://m.media-amazon.com/images/M/MV5BMTQyNTEyMzY1OF5BMl5BanBnXkFtZTcwNzE1MTEzOA@@._V1_UY98_CR1,0,67,98_AL_.jpg",tt2106741,Xiao shi de zi dan,2012,108.0,"Action, Adventure, Drama",6.5,65,"Son Donglu, a newly promoted detective teams up with Guo Zhui, fastest gunman in Tiancheng and Xiaowu, a novice policeman to investigate the mystery deaths in a bullet factory.",2291,"[{'id': 'nm0492305', 'name': 'Chi-Leung Law'}]","[{'id': 'nm0874866', 'name': 'Nicholas Tse'}, {'id': 'nm0490513', 'name': 'Ching Wan Lau'}, {'id': 'nm2468729', 'name': 'Mi Yang'}, {'id': 'nm3628606', 'name': 'Boran Jing'}]",cmn
"https://m.media-amazon.com/images/M/MV5BYjc0ZjkwMDEtY2EwZS00YTQ2LTk1ZWUtNTExMzRiZTY3MDk1XkEyXkFqcGdeQXVyNjUxOTI2MTk@._V1_UY98_CR1,0,67,98_AL_.jpg",tt2176668,Er ci pu guang,2012,105.0,"Crime, Drama, Mystery",5.6,,"When Song Qi stumbles upon her boyfriend's affair with her best friend, her life quickly starts falling apart and she is subsequently drawn into a quicksand of revenge and murder. Though ...                See full summary »",474,"[{'id': 'nm1165953', 'name': 'Yu Li'}]","[{'id': 'nm1549063', 'name': 'Bingbing Fan'}, {'id': 'nm2682046', 'name': 'Shaofeng Feng'}, {'id': 'nm2356251', 'name': 'Siyan Huo'}, {'id': 'nm0946287', 'name': 'Anlian Yao'}]",cmn
"https://m.media-amazon.com/images/M/MV5BOTBjZmQ5YTYtZGZjNy00MDZhLTg3NzctODcwODI5YTljNDAxXkEyXkFqcGdeQXVyMjUyNDk2ODc@._V1_UY98_CR1,0,67,98_AL_.jpg",tt2063011,Jik zin,2012,122.0,"Action, Drama, Thriller",5.9,32,"International Security Affairs agent Jon is on a dangerous mission to escort a criminal scientist to another country. En route, a member of his team, Sean, turns out to be a traitor and ...                See full summary »",2726,"[{'id': 'nm0482592', 'name': 'Dante Lam'}]","[{'id': 'nm1727100', 'name': 'Jay Chou'}, {'id': 'nm0874866', 'name': 'Nicholas Tse'}, {'id': 'nm3391237', 'name': 'Peng Lin'}, {'id': 'nm3138980', 'name': 'Bing Bai'}]",cmn
"https://m.media-amazon.com/images/M/MV5BZDEwMzQ4MTMtZjkxMy00MDQ3LWFkZTgtYjNkZmJmM2RkNjM0XkEyXkFqcGdeQXVyMjg0MTI5NzQ@._V1_UY98_CR1,0,67,98_AL_.jpg",tt2385138,Bian jing feng yun,2012,100.0,"Crime, Drama, Thriller",7.0,,The story revolves around a drug dealer who falls in love with his hostage and decides to quit the business following one final deal.,494,"[{'id': 'nm2965065', 'name': 'Er Cheng'}]","[{'id': 'nm0196433', 'name': 'Dahong Ni'}, {'id': 'nm0838944', 'name': 'Honglei Sun'}, {'id': 'nm3437899', 'name': 'Luodan Wang'}, {'id': 'nm4680419', 'name': 'Kun Yang'}]",cmn
"https://m.media-amazon.com/images/M/MV5BMTc1NjU4MTQ5OV5BMl5BanBnXkFtZTgwMDY3NjI2MDE@._V1_UX67_CR0,0,67,98_AL_.jpg",tt2251662,Da Wu Dang zhi tian di mi ma,2012,100.0,Action,5.3,,"In early Republican China, rumors were going around about the treasure in Wudang Mountain. An American conspirator took his well-trained kung fu daughter to Wudang by sponsoring a Taoist martial arts competition, to steal the treasure.",962,"[{'id': 'nm0504980', 'name': 'Patrick Leung'}]","[{'id': 'nm0158414', 'name': 'Wenzhuo Zhao'}, {'id': 'nm2468729', 'name': 'Mi Yang'}, {'id': 'nm0266658', 'name': 'Siu-Wong Fan'}, {'id': 'nm3253626', 'name': 'Yu-Hang To'}]",cmn
"https://m.media-amazon.com/images/M/MV5BN2JjZjRlZWUtYTAxYS00Zjc1LWFkM2YtMWVlMjFlYzhjMGZhXkEyXkFqcGdeQXVyNTIxMjUyMTk@._V1_UY98_CR1,0,67,98_AL_.jpg",tt2513344,Wan jian chuan xin,2012,120.0,Drama,7.7,,Family drama about a woman desperate to ascend to the middle class and willing to pay any price. Powerful and emotionally tense.,624,"[{'id': 'nm3937763', 'name': 'Jing Wang'}]","[{'id': 'nm3037470', 'name': 'Bingyan Yan'}, {'id': 'nm3041655', 'name': 'Tommy Shanahan'}, {'id': 'nm7209188', 'name': 'Gang Chen'}, {'id': 'nm9741248', 'name': 'Minglan He'}]",cmn
"https://m.media-amazon.com/images/M/MV5BMjIwNzM1MzIyMF5BMl5BanBnXkFtZTgwNDcyNTQyMTE@._V1_UY98_CR4,0,67,98_AL_.jpg",tt2190232,Wu yan,2012,92.0,Drama,5.9,,"A guy is found by the police swimming naked. He can't, or refuses to, speak and is sent to a hospital. Since no diagnosis can be made, he will be transferred to a mental hospital, when his ...                See full summary »",444,"[{'id': 'nm0161295', 'name': 'Simon Chung'}]","[{'id': 'nm5170751', 'name': 'Pierre-Matthieu Vital'}, {'id': 'nm5170638', 'name': 'Qilun Gao'}, {'id': 'nm2858358', 'name': 'Yung Yung Yu'}, {'id': 'nm5170710', 'name': 'Jian Jiang'}]",cmn
"https://m.media-amazon.com/images/M/MV5BZjVjY2IzMjMtNTIyOC00MTBjLThjYWMtOWIwNzhiNGExYWNkXkEyXkFqcGdeQXVyMjg0MTI5NzQ@._V1_UY98_CR1,0,67,98_AL_.jpg",tt2459496,Hua yang,2012,122.0,"Drama, History, Romance",5.2,,"The height of gaiety on Piao Dao. Merchants and pirates may have their treasures but the biggest prizes are the sensational twin singing courtesans, who are ripe for deflowering. Known as ...                See full synopsis »",189,"[{'id': 'nm1548552', 'name': 'Zero Chou'}]","[{'id': 'nm2442121', 'name': 'Ivy Yi-Han Chen'}, {'id': 'nm1543046', 'name': 'Jerry Yan'}, {'id': 'nm1701227', 'name': 'Michelle Chen'}, {'id': 'nm3138348', 'name': 'Joe Cheng Yuan Chang'}]",cmn
"https://m.media-amazon.com/images/M/MV5BZDdkNzYwMTUtMzlmYy00NTA5LTljNjEtNDk4NWI5NjAxOGJhXkEyXkFqcGdeQXVyMjExMzEyNTM@._V1_UY98_CR1,0,67,98_AL_.jpg",tt1534449,Kung Fu Man,2012,,Action,4.9,,"Chen Ping protects a young boy named ""Christophe"" from his kidnappers.",137,"[{'id': 'nm0950604', 'name': 'Cheung-Yan Yuen'}, {'id': 'nm0948075', 'name': 'Ying Ning'}]","[{'id': 'nm0104376', 'name': 'Vanessa Branch'}, {'id': 'nm0155392', 'name': 'Tiger Hu Chen'}, {'id': 'nm3834046', 'name': 'Arman Darbo'}, {'id': 'nm4396246', 'name': 'Igor Darbo'}]",cmn
"https://m.media-amazon.com/images/M/MV5BNjUwYWNiNTEtZDdmYS00OTdhLTlmZTUtNTQ1NjE1ZTNmMzMzXkEyXkFqcGdeQXVyNTY4ODAxODI@._V1_UY98_CR2,0,67,98_AL_.jpg",tt2300438,"Gaosu tamen, wo cheng baihe qu le",2012,99.0,Drama,6.5,,"73 years old Ma and his good mate Cao were once coffin makers. Since Chinese government implemented the practice of cremation, the demand for coffins dried up therefore Ma spend his days ...                See full summary »",104,"[{'id': 'nm4772581', 'name': 'Ruijun Li'}]","[{'id': 'nm4771575', 'name': 'Xingchun Ma'}, {'id': 'nm5191084', 'name': 'Long Tang'}, {'id': 'nm13339867', 'name': 'Siyi Wang'}, {'id': 'nm4772502', 'name': 'Min Zhang'}]",cmn
"https://m.media-amazon.com/images/M/MV5BNGIxNWY5YmYtYTczMS00ZjMwLTk5NDYtNjFkNzRhYzRjY2FlXkEyXkFqcGdeQXVyMjg0MTI5NzQ@._V1_UY98_CR1,0,67,98_AL_.jpg",tt2455730,Xi li ren qi: Zui zhong hui - Xing fu nan bu nan,2012,109.0,"Drama, Romance",4.9,,The movie continues the story from the TV series which ended with a cliff hanger where the wife was deciding whether to return to her cheating husband or have a relationship with her boss.,173,"[{'id': 'nm3423578', 'name': 'Pei-hua Wang'}, {'id': 'nm5831944', 'name': 'Joseph Wang'}]","[{'id': 'nm3485729', 'name': 'Sonia Sui'}, {'id': 'nm5324139', 'name': 'Chris Wang'}, {'id': 'nm2437412', 'name': 'Sheng-hao Wen'}, {'id': 'nm6182481', 'name': 'Karen Ying-Chen Hu'}]",cmn
"https://m.media-amazon.com/images/M/MV5BNDA0NjMwODEwN15BMl5BanBnXkFtZTgwOTQ2NjA2MDE@._V1_UY98_CR3,0,67,98_AL_.jpg",tt2202471,Ai,2012,128.0,"Drama, Romance",6.5,,"Eight people try to end their loneliness by searching for that one person to love, who can make their life complete.",1622,"[{'id': 'nm0633080', 'name': 'Doze Niu'}]","[{'id': 'nm0795517', 'name': 'Shu Qi'}, {'id': 'nm3609766', 'name': 'Mark Chao'}, {'id': 'nm0955505', 'name': 'Wei Zhao'}, {'id': 'nm3419723', 'name': 'Amber Kuo'}]",cmn
"https://m.media-amazon.com/images/M/MV5BY2U2ODFiMzAtMTY3Ni00MGIwLWFlODgtNzE2OGY3OGMwOTdhXkEyXkFqcGdeQXVyMjg0MTI5NzQ@._V1_UY98_CR0,0,67,98_AL_.jpg",tt2414370,Pi zi ying xiong shou bu qu: Quan mian kai zhan,2012,142.0,"Action, Comedy",6.2,,"A policeman, who is fearless to death, can do anything for just one truth, while a gangster, who fears death the most, has drew life threats from his risky action all for love. One ...                See full summary »",721,"[{'id': 'nm2174582', 'name': 'Yueh-Hsun Tsai'}]","[{'id': 'nm3609766', 'name': 'Mark Chao'}, {'id': 'nm2348646', 'name': 'Bo Huang'}, {'id': 'nm2854802', 'name': 'Angelababy'}, {'id': 'nm1446980', 'name': 'Terri Kwan'}]",cmn
"https://m.media-amazon.com/images/M/MV5BN2QxY2U5ZDAtN2YwYi00MzNhLThhMjktNDFmYWY1MjhmNzVlXkEyXkFqcGdeQXVyMTk2MDc1MjQ@._V1_UY98_CR1,0,67,98_AL_.jpg",tt2393829,Huang jin da jie an,2012,108.0,Drama,5.9,,A gangster is accidentally involved in a resistance robbery plot.,698,"[{'id': 'nm1928500', 'name': 'Hao Ning'}]","[{'id': 'nm5042060', 'name': 'Jiayin Lei'}, {'id': 'nm0849920', 'name': 'Hong Tao'}, {'id': 'nm3138747', 'name': 'Yuanyuan Cheng'}, {'id': 'nm5042054', 'name': 'Keiichi Yamasaki'}]",cmn
"https://m.media-amazon.com/images/M/MV5BZTdkOWViNTMtYmM0Yy00YzVmLWFjNzEtZGM1NGQxMGNmOWU0XkEyXkFqcGdeQXVyMjg0MTI5NzQ@._V1_UY98_CR2,0,67,98_AL_.jpg",tt1838515,Yin shi nan nü - Hao yuan you hao jin,2012,107.0,"Comedy, Romance",4.8,,The film aims to present the deep meaning of humanistic philosophy and medicinal cuisine in Chinese cuisine.,187,"[{'id': 'nm2076015', 'name': 'Jui-Yuan Tsao'}]","[{'id': 'nm2356251', 'name': 'Siyan Huo'}, {'id': 'nm0013833', 'name': 'Ah-Lei Gua'}, {'id': 'nm2077857', 'name': 'Blue Cheng-Lung Lan'}, {'id': 'nm0874684', 'name': 'Kenneth Tsang'}]",cmn
"https://m.media-amazon.com/images/M/MV5BYzQzMGNjNmItM2I4MC00Y2NmLTlhMjQtMjVmMmNlMWFjNWJkXkEyXkFqcGdeQXVyMjg0MTI5NzQ@._V1_UY98_CR1,0,67,98_AL_.jpg",tt2417286,Qin ai de nai nai,2012,85.0,"Drama, Family, Fantasy",6.7,,This is not a story about a loving grandmother.,100,"[{'id': 'nm3138118', 'name': 'Yu-Ning Chu'}]","[{'id': 'nm5290686', 'name': 'Shiou Yun Chang'}, {'id': 'nm0461940', 'name': 'Lawrence Ko'}, {'id': 'nm2115821', 'name': 'Mei-Hsiu Lin'}, {'id': 'nm4193385', 'name': 'Chien-Na Lee'}]",cmn
"https://m.media-amazon.com/images/M/MV5BYzQxMjA3ZjgtNDY5Mi00ZWRmLTllYjMtNjQ0NzNhNjA0YTMzXkEyXkFqcGdeQXVyMjQwMjk0NjI@._V1_UY98_CR1,0,67,98_AL_.jpg",tt2303104,Qing Yan,2012,86.0,"Crime, Horror, Mystery",5.3,,"Hao Dong suffers from insomnia and witnesses another murder, but his girlfriend Yifan believes he is imagining it.",107,"[{'id': 'nm0946875', 'name': 'Herman Yau'}]","[{'id': 'nm3154777', 'name': 'Xuan Huang'}, {'id': 'nm1894038', 'name': 'Fiona Sit'}, {'id': 'nm3511225', 'name': 'Chuchu Zhou'}, {'id': 'nm7830806', 'name': 'Daqing Shang'}]",cmn
"https://m.media-amazon.com/images/M/MV5BZjI0YWJiMjItZDQ4ZS00YTczLTkwZjMtZTE0Y2JlMmFjMGMwXkEyXkFqcGdeQXVyMjExMzEyNTM@._V1_UY98_CR1,0,67,98_AL_.jpg",tt2290645,Sha sheng,2012,108.0,"Drama, Mystery",6.5,,"The violent death of an unpopular village resident is initially blamed on an infectious disease, but an investigation shows that everybody in the village had a reason to murder him.",598,"[{'id': 'nm1299690', 'name': 'Hu Guan'}]","[{'id': 'nm2348646', 'name': 'Bo Huang'}, {'id': 'nm0945189', 'name': 'Simon Yam'}, {'id': 'nm1451398', 'name': 'Alec Su'}, {'id': 'nm0197240', 'name': 'Leon Dai'}]",cmn
"https://m.media-amazon.com/images/M/MV5BNGRlMmZkYmUtYzA4Ni00MWY5LWI0YzktNTIwZmNlY2NiNTA1XkEyXkFqcGdeQXVyMjg0MTI5NzQ@._V1_UY98_CR0,0,67,98_AL_.jpg",tt2137992,Xin tian sheng yi dui,2012,100.0,Family,5.4,,"Ah B (Vic Chou) was once a champion motorbike racer but lost everything in a fixed match. His wife Jiawei (Mini Yang) left him, and he has since abandoned himself to drinking and gambling ...                See full summary »",189,"[{'id': 'nm0160900', 'name': 'Yen-Ping Chu'}]","[{'id': 'nm3423541', 'name': 'Riva Chang'}, {'id': 'nm6479818', 'name': 'Jet Chao'}, {'id': 'nm5819185', 'name': 'Chusheng Chen'}, {'id': 'nm4531844', 'name': 'Ella Chen'}]",cmn
"https://m.media-amazon.com/images/M/MV5BNzJmZmM2NjMtMjExNy00YjBiLTg1MTctOWM0ZmJiMGQxM2MyXkEyXkFqcGdeQXVyNzI1NzMxNzM@._V1_UX67_CR0,0,67,98_AL_.jpg",tt2271555,Qing mi,2012,102.0,"Drama, Romance, Thriller",5.2,,"Hui Bao is an actress rehearsing for a performance in a theater play alongside her boyfriend Nan. Falling sick and being unable to perform in the play, her twin sister Hui Xiang replace her...                See full summary »",244,"[{'id': 'nm0481674', 'name': 'Miu-Suet Lai'}]","[{'id': 'nm0795517', 'name': 'Shu Qi'}, {'id': 'nm3481199', 'name': 'Shu Chen'}, {'id': 'nm1284845', 'name': 'Shawn Yue'}, {'id': 'nm0944444', 'name': 'Meijuan Xi'}]",cmn
"https://m.media-amazon.com/images/M/MV5BMTUzMjRhZDAtYTc5NC00OThmLWE2YWYtNjc4OTVkMjM0MmI0XkEyXkFqcGdeQXVyMjExMzEyNTM@._V1_UY98_CR0,0,67,98_AL_.jpg",tt2363421,Nü yong,2012,96.0,"Mystery, Romance, Thriller",5.5,,"After being kidnapped, a young woman awakens three months later on the side of a road with no memory of her abduction. Subsequently, she begins to experience psychological episodes that mirror her abductor's persona.",147,"[{'id': 'nm5006565', 'name': 'Chu-ji Qiu'}]","[{'id': 'nm9026758', 'name': 'Zhan Chuheng'}, {'id': 'nm1251064', 'name': 'Jie Cui'}, {'id': 'nm9026757', 'name': 'Wendy Gao'}, {'id': 'nm2096707', 'name': 'Wei Lee'}]",cmn
"https://m.media-amazon.com/images/M/MV5BZmQ2MDQ1Y2EtNDVkYy00NzI3LWEzYTUtZmE2Y2VlMGIxOTFhXkEyXkFqcGdeQXVyMjExMzEyNTM@._V1_UY98_CR1,0,67,98_AL_.jpg",tt2401013,Fei yue lao ren yuan,2012,105.0,Drama,6.6,,"A moving road movie about two retired bus drivers, old Zhou and old Ge, who find themselves in the same retirement home and decide to escape for one final escapade with a gang of other senior citizens.",198,"[{'id': 'nm0955434', 'name': 'Yang Zhang'}]","[{'id': 'nm0944632', 'name': 'Huanshan Xu'}, {'id': 'nm0943177', 'name': 'Tian-Ming Wu'}, {'id': 'nm0508353', 'name': 'Bin Li'}, {'id': 'nm3037470', 'name': 'Bingyan Yan'}]",cmn
"https://m.media-amazon.com/images/M/MV5BODg5MGFhOTMtYWQzYS00OTI0LTliMzMtOGZjYzcyNGMzMGNmXkEyXkFqcGdeQXVyMzc1NTUwNjM@._V1_UY98_CR3,0,67,98_AL_.jpg",tt2458256,Zui hou yi ye,2012,92.0,"Drama, Romance",5.6,,"Shen Wei and Tong Xin wake up one morning in a bed, with no idea what happened or even who the person in bed with them is. The two split with few words, but each is missing something. What is actually happening last night?",108,"[{'id': 'nm1186589', 'name': 'Chi-Man Wan'}, {'id': 'nm1229124', 'name': 'Derek Tsang'}]","[{'id': 'nm1284845', 'name': 'Shawn Yue'}, {'id': 'nm1846368', 'name': 'Jingchu Zhang'}, {'id': 'nm1204831', 'name': 'Lawrence Chou'}, {'id': 'nm4998726', 'name': 'Yoga Lin'}]",cmn
"https://m.media-amazon.com/images/M/MV5BY2RhOTU5MTctNDhiMC00YzFmLTgyNzYtNzc0ZjRlNWFkNDhkXkEyXkFqcGdeQXVyMjg0MTI5NzQ@._V1_UY98_CR1,0,67,98_AL_.jpg",tt2417568,Tian mi mi,2012,114.0,"Drama, Romance",5.7,,"Xiao Yang is in his teens. He cares about the people around him in his naive way. But apart from Xiao Ma, no one really appreciates him; even though he never gives up showing his love to his family and friends.",519,"[{'id': 'nm1314647', 'name': 'Chao-jen Hsu'}]","[{'id': 'nm0497455', 'name': 'Lieh Lee'}, {'id': 'nm5293307', 'name': 'Shao-Yang Huang'}, {'id': 'nm3485729', 'name': 'Sonia Sui'}, {'id': 'nm0066223', 'name': 'Kenny Bee'}]",cmn
"https://m.media-amazon.com/images/M/MV5BNzUzNDhmYzMtOTllYS00OWNmLTkyZGYtMjUwNDhmNTE5NWUxXkEyXkFqcGdeQXVyMjQ2MTk1OTE@._V1_UY98_CR3,0,67,98_AL_.jpg",tt2273470,Beijing Blues,2012,118.0,"Action, Crime",6.5,,"Beijing police officer Zhang Hui Ling, who patrols Haidian District's Shuangyushu neighborhood in Beijing, has a job to do. Every day, he has to go out in the street with his cohort of ...                See full summary »",297,"[{'id': 'nm2433588', 'name': 'Qunshu Gao'}]","[{'id': 'nm5477049', 'name': 'Qianqian Kong'}, {'id': 'nm5160236', 'name': 'Lixian Zhang'}]",cmn
"https://m.media-amazon.com/images/M/MV5BMDEwODVkODEtY2FmZi00MmE1LWJlNjctNmQzYTU1YWNmYzUwXkEyXkFqcGdeQXVyMjg0MTI5NzQ@._V1_UY98_CR1,0,67,98_AL_.jpg",tt2460414,BBS xiang min de zheng yi,2012,106.0,Drama,5.6,,"A reporter is tasked to find out information about the world's most popular internet forum, BBS. As she explores the internet world, she finds the danger and power these forums hold.",320,"[{'id': 'nm6558127', 'name': 'Hero Lin'}]","[{'id': 'nm2442121', 'name': 'Ivy Yi-Han Chen'}, {'id': 'nm1250939', 'name': 'Bo-lin Chen'}, {'id': 'nm6821472', 'name': 'Grace Wen-Yi Lin'}, {'id': 'nm3609436', 'name': 'Chieh-kai Shiou'}]",cmn
"https://m.media-amazon.com/images/M/MV5BOTU5MTRmZDItNGNkNy00ZmNlLTk4OGMtMWVhYjc2ZWVkMjc1XkEyXkFqcGdeQXVyMjg0MTI5NzQ@._V1_UY98_CR1,0,67,98_AL_.jpg",tt2275080,Mak Dau dong dong poon ngo sum,2012,79.0,"Animation, Comedy",6.7,,"The principal of the kindergarten put a lot of effort into teaching music to the kids because it was ""free"". The was of importance because the kindergarten was under the threat to be shut ...                See full summary »",304,"[{'id': 'nm1212034', 'name': 'Brian Tse'}]","[{'id': 'nm0938893', 'name': 'Anthony Chau-Sang Wong'}, {'id': 'nm0510950', 'name': 'Sandra Kwan Yue Ng'}]",cmn
"https://m.media-amazon.com/images/M/MV5BN2M5YWVmMDctMGRmNC00ZDY5LWJjZGItNjUzZDg1MjE1NTQ5XkEyXkFqcGdeQXVyMjExMzEyNTM@._V1_UY98_CR1,0,67,98_AL_.jpg",tt2459282,Gao ding yue fu da ren,2012,94.0,Comedy,5.6,,"Hyun-Joon (Song Sae-Byeok) is a comic book artist from the Jeolla-do region, now working in the capital city of Seoul. One day he meets Da-Hong (Lee Si-Young), a fan of his who is from the ...                See full summary »",151,"[{'id': 'nm1934885', 'name': 'Hai-shu Li'}]","[{'id': 'nm0788415', 'name': 'Shao-Tung Chou'}, {'id': 'nm0401208', 'name': 'Shiu-Hung Hui'}, {'id': 'nm3391237', 'name': 'Peng Lin'}, {'id': 'nm3604440', 'name': 'Jie Liu'}]",cmn
"https://m.media-amazon.com/images/M/MV5BOWFhMTU0OTItNTIyOC00NThmLWI0M2YtMTY5YWQwZTE2ZDhhXkEyXkFqcGdeQXVyMjg0MTI5NzQ@._V1_UY98_CR0,0,67,98_AL_.jpg",tt2301291,Zhen tou,2012,124.0,"Comedy, Drama",6.6,,Ah Tai (Alan Ko) failed in his pursuit to become a rock star and has now returned home. He is suddenly appointed the leader of his father's din-tao troupe (traditional drumming group) and he vows to defeat his rivals.,385,"[{'id': 'nm4949493', 'name': 'Kai Fung'}]","[{'id': 'nm0461934', 'name': 'Alan Ko'}, {'id': 'nm2218383', 'name': 'Alien Huang'}, {'id': 'nm3409358', 'name': 'Crystal Lin'}, {'id': 'nm4411342', 'name': 'Esther Liu'}]",cmn
"https://m.media-amazon.com/images/M/MV5BN2YyNDA5MTMtMDgxNy00ZWEzLWE2NzEtODI4MDVlYTkzOGYxXkEyXkFqcGdeQXVyMjQwMjk0NjI@._V1_UY98_CR1,0,67,98_AL_.jpg",tt2191861,Ai de mian bao hun,2012,114.0,"Comedy, Romance",6.1,,"Gao-bing works in a bakery in a small town. The owner, Mr Chiu, is so into his Rock 'n 'Roll band, and the apprentice Di doesn't seem enthusiastic about learning baking at all. The business...                See full summary »",503,"[{'id': 'nm4371472', 'name': 'Pin-Chuan Kao'}]","[{'id': 'nm3889571', 'name': 'Han Dian Chen'}, {'id': 'nm1701227', 'name': 'Michelle Chen'}, {'id': 'nm6648233', 'name': 'Ying-Chieh Chen'}, {'id': 'nm3561863', 'name': 'Yan-Hsi Hou'}]",cmn
"https://m.media-amazon.com/images/M/MV5BMTY1MjliMjAtZDRjMy00NTAwLWE3NjUtNWYzOTk5YmUzNTcxXkEyXkFqcGdeQXVyMjQ2MTk1OTE@._V1_UY98_CR1,0,67,98_AL_.jpg",tt2930988,Mei jie,2012,91.0,"Comedy, Drama, Romance",7.2,,"Tiedan's love experience started early in the age of 8 when he fell into adult Mei Jie, but Mei Jie moved to other place with her daughters when the Er-Ren-Tai traditional opera was ...                See full summary »",139,"[{'id': 'nm3903865', 'name': 'Jie Hao'}]","[{'id': 'nm3900454', 'name': 'Lan Ye'}, {'id': 'nm5683947', 'name': 'Si Feng'}, {'id': 'nm5683838', 'name': 'Xia Ge'}, {'id': 'nm5684134', 'name': 'Huanrong Du'}]",cmn
