poster,imdb-id,title,release-year,runtime,genre,imdb-rating,metascore,overview,votes,directors,cast,language
"https://m.media-amazon.com/images/M/MV5BY2Q5YzBiOTctOTQ4ZS00ZmJjLWIxYWYtMjJkZjk1NjViNDg1XkEyXkFqcGdeQXVyMTEzNzg0Mjkx._V1_UY98_CR1,0,67,98_AL_.jpg",tt2623460,Kanna Laddu Thinna Aasaiya,2013,135.0,Comedy,5.4,,Three funny men uses different tactics to impress a next-door girl.,771,"[{'id': 'nm5462083', 'name': 'K.S. Manikandan'}]","[{'id': 'nm1962272', 'name': 'Santhanam'}, {'id': 'nm5463331', 'name': 'Powerstar Srinivasan'}, {'id': 'nm5463540', 'name': 'Sethu'}, {'id': 'nm3106095', 'name': 'Vishakha Singh'}]",ta
"https://m.media-amazon.com/images/M/MV5BNmY5OGE1MmUtMTY4NS00MWU0LWJhZTEtNDBiNjBlNTQzOWYyXkEyXkFqcGdeQXVyMTEzNzg0Mjkx._V1_UY98_CR2,0,67,98_AL_.jpg",tt3232316,6,2013,129.0,"Crime, Drama, Thriller",7.0,,A father travels across six states to try and solve the mystery of his son's disappearance.,224,"[{'id': 'nm12002688', 'name': 'V.Z. Durai'}, {'id': 'nm1922191', 'name': 'V.Z. Dhorai'}]","[{'id': 'nm1512238', 'name': 'Sandra Amy'}, {'id': 'nm3601386', 'name': 'Poonam Kaur'}, {'id': 'nm4031719', 'name': 'Nagineedu'}, {'id': 'nm1421767', 'name': 'Shaam'}]",ta
"https://m.media-amazon.com/images/M/MV5BZjI4MmI0MWYtMTJjOS00ZmYzLWFjNjAtOWE4NzI1OGYwZGM3XkEyXkFqcGdeQXVyMTEzNzg0Mjkx._V1_UY98_CR3,0,67,98_AL_.jpg",tt12993628,David,2013,118.0,Drama,5.8,,"The plot revolves around the lives of two different men named David, who are about to take a step which is going to change their lives forever.",167,"[{'id': 'nm2349060', 'name': 'Bejoy Nambiar'}]","[{'id': 'nm1069034', 'name': 'Lara Dutta'}, {'id': 'nm0272902', 'name': 'Remo Fernandes'}, {'id': 'nm1883318', 'name': 'Jiiva'}, {'id': 'nm0442479', 'name': 'Satish Kaushik'}]",ta
"https://m.media-amazon.com/images/M/MV5BYmMzYmVkMjItZjBmZi00NWE2LTlkODItMmYyOTdjOWY0YjFiXkEyXkFqcGdeQXVyMTEzNzg0Mjkx._V1_UY98_CR1,0,67,98_AL_.jpg",tt3253548,Naveena Saraswathi Sabatham,2013,149.0,"Comedy, Fantasy",4.8,,"Lord Shiva crashes four friends' bachelor party as he wants to recruit four mortals. After a night of debauchery, they wake up on a deserted island with no memory of how they got there.",252,"[{'id': 'nm5965104', 'name': 'K. Chandru'}]","[{'id': 'nm0415773', 'name': 'Jai'}, {'id': 'nm3223429', 'name': 'Nivetha Thomas'}, {'id': 'nm2536215', 'name': 'Vtv Ganesh'}, {'id': 'nm3561501', 'name': 'Sathyan'}]",ta
"https://m.media-amazon.com/images/M/MV5BMTM4OGMxMTUtM2M1Yy00MWM3LTlmMWMtNjk0MTdmNzA4OTI5XkEyXkFqcGdeQXVyMTEzNzg0Mjkx._V1_UY98_CR1,0,67,98_AL_.jpg",tt2771926,Vathikuchi,2013,135.0,"Action, Thriller",6.3,,A share auto-driver gets entangled in a plot where 3 criminals want him dead.,310,"[{'id': 'nm5575109', 'name': 'Kinslin'}]","[{'id': 'nm5575042', 'name': 'Dileepan'}, {'id': 'nm3592766', 'name': 'Anjali'}, {'id': 'nm0764853', 'name': 'Saranya Ponvannan'}, {'id': 'nm3164292', 'name': 'Sampath Raj'}]",ta
"https://m.media-amazon.com/images/M/MV5BYTMyODJhMWEtNzc4OS00MGFlLTkzNWMtNjc5ZjQ4NDg5YWMyXkEyXkFqcGdeQXVyMTEzNzg0Mjkx._V1_UX67_CR0,0,67,98_AL_.jpg",tt2555958,Arrambam,2013,157.0,"Action, Drama, Mystery",7.0,,A mysterious man along with a young computer hacker tries to unveil a major government conspiracy which resulted in several bloody deaths.,10238,"[{'id': 'nm3315387', 'name': 'Vishnuvardhan'}]","[{'id': 'nm0015001', 'name': 'Ajith Kumar'}, {'id': 'nm1951127', 'name': 'Arya'}, {'id': 'nm1521381', 'name': 'Nayanthara'}, {'id': 'nm3966456', 'name': 'Taapsee Pannu'}]",ta
"https://m.media-amazon.com/images/M/MV5BMzMxZGEwMjQtZTRiMC00YTk3LTk5OGYtMjY1NzJhMzlmOWI4XkEyXkFqcGdeQXVyMTY0MDk0NjE3._V1_UY98_CR2,0,67,98_AL_.jpg",tt3381754,Kalyana Samayal Saadham,2013,115.0,"Comedy, Romance",7.1,,An arranged marriage is interrupted by a rather personal problem.,623,"[{'id': 'nm9179246', 'name': 'R.S. Prasanna'}]","[{'id': 'nm1137738', 'name': 'Prasanna'}, {'id': 'nm3262096', 'name': 'Lekha Washington'}, {'id': 'nm0304265', 'name': 'Delhi Ganesh'}, {'id': 'nm2704843', 'name': 'Uma Pathmanabhan'}]",ta
"https://m.media-amazon.com/images/M/MV5BODExNTRjYTgtODk1Ny00Y2U2LTg3ZDQtY2QxZTQxNmY5ODU2XkEyXkFqcGdeQXVyMTEzNzg0Mjkx._V1_UY98_CR1,0,67,98_AL_.jpg",tt3215282,Desingu Raja,2013,,Comedy,5.0,,A love story with boy and girl from feuding villages.,199,"[{'id': 'nm1318819', 'name': 'Ezhil'}]","[{'id': 'nm2156989', 'name': 'Vimal'}, {'id': 'nm3766840', 'name': 'Bindhu Madhavi'}, {'id': 'nm4262344', 'name': 'Soori'}, {'id': 'nm2670388', 'name': 'Singampuli'}]",ta
"https://m.media-amazon.com/images/M/MV5BMGQ0MWYxOGUtYjZjZC00MzNmLTg1ODUtNjI1NDY1ODM0ZGVkXkEyXkFqcGdeQXVyMTEzNzg0Mjkx._V1_UY98_CR4,0,67,98_AL_.jpg",tt2562162,Ivan Veramaathiri,2013,150.0,"Action, Thriller",6.0,,A young vigilante takes on a rowdy and suffers the consequences.,359,"[{'id': 'nm4690425', 'name': 'M. Saravanan'}]","[{'id': 'nm5076645', 'name': 'Vikram Prabhu'}, {'id': 'nm6120872', 'name': 'Surbhi'}, {'id': 'nm3443674', 'name': 'Ganesh Venkatraman'}, {'id': 'nm1555207', 'name': 'Vamsi'}]",ta
"https://m.media-amazon.com/images/M/MV5BZTE4YjAwOGEtOGJiMS00YzRjLWE0YzItOGU3NDgyYWY4NGQzXkEyXkFqcGdeQXVyMTEzNzg0Mjkx._V1_UY98_CR8,0,67,98_AL_.jpg",tt3426300,Madha Yaanai Koottam,2013,139.0,"Drama, Thriller",7.2,,Prithivi kill his uncle's son unfortunately. So his uncle and other family members take revenge on him.,248,"[{'id': 'nm6176574', 'name': 'Vikram Sugumaran'}]","[{'id': 'nm6453091', 'name': 'Kathir'}, {'id': 'nm1807524', 'name': 'Anju'}, {'id': 'nm5263646', 'name': 'Viji Chandrashekhar'}, {'id': 'nm1957308', 'name': 'V. Jayaprakash'}]",ta
"https://m.media-amazon.com/images/M/MV5BNGJjNjVhYWYtODU5Ny00ZjYwLWE0MzAtZTg2NTljODIxYjJmXkEyXkFqcGdeQXVyMTEzNzg0Mjkx._V1_UY98_CR1,0,67,98_AL_.jpg",tt3177080,Haridas,2013,146.0,"Drama, Sport, Thriller",7.2,,Sivadas (Kishore) is tough-talking encounter specialist in the police department. He has a mission to pin down a gangster and mercenary and is hot on his trail. But life changes for the ...                See full summary »,218,"[{'id': 'nm5936406', 'name': 'Kumaravelan'}]","[{'id': 'nm3132784', 'name': 'Kishore Kumar G.'}, {'id': 'nm0998044', 'name': 'Sneha'}, {'id': 'nm5936407', 'name': 'Prithviraj Das'}, {'id': 'nm4262344', 'name': 'Soori'}]",ta
"https://m.media-amazon.com/images/M/MV5BMTg0NzViY2MtZTRkMS00NTljLTk1MjMtYzhmMTQ0NmMyOTQxXkEyXkFqcGdeQXVyMTEzNzg0Mjkx._V1_UY98_CR2,0,67,98_AL_.jpg",tt2576666,Naan Rajavaga Pogiren,2013,128.0,"Action, Drama, Thriller",4.9,,A young man gets sucked into an adventure as he searches for his lookalike.,118,"[{'id': 'nm5423029', 'name': 'Prithvi Rajkumar'}]","[{'id': 'nm1150216', 'name': 'Nakhul'}, {'id': 'nm5422323', 'name': 'Chandini'}, {'id': 'nm5423109', 'name': 'Avani Modi'}, {'id': 'nm0542478', 'name': 'Manivannan'}]",ta
"https://m.media-amazon.com/images/M/MV5BNThlMDM0YzctNzAxOC00MzQwLTk0M2ItMThmYzlhMDBiZDUzXkEyXkFqcGdeQXVyMTEzNzg0Mjkx._V1_UY98_CR1,0,67,98_AL_.jpg",tt2187102,Moondru Per Moondru Kaadhal,2013,,Romance,5.1,,Three couples and their love story.,305,"[{'id': 'nm1182689', 'name': 'Vasanth'}]","[{'id': 'nm0035018', 'name': 'Arjun Sarja'}, {'id': 'nm0155741', 'name': 'Cheran'}, {'id': 'nm2156989', 'name': 'Vimal'}, {'id': 'nm2522571', 'name': 'Muktha George'}]",ta
"https://m.media-amazon.com/images/M/MV5BZjgxYzgyNjUtMjU0MC00ZmIxLTljNzItYzU0NDYwZGRlMzAzXkEyXkFqcGdeQXVyNDE3Mzk5NDU@._V1_UY98_CR2,0,67,98_AL_.jpg",tt2877084,Gouravam,2013,,Drama,4.8,,"Arjun visits Vennur, the village of his college friend Shanmugam. Vennur is that kind of place which still practices untouchability. Arjun learns that his lower caste friend had eloped with...                See full summary »",164,"[{'id': 'nm1701255', 'name': 'Radha Mohan'}]","[{'id': 'nm4417069', 'name': 'Yami Gautam'}, {'id': 'nm0621937', 'name': 'Nassar'}, {'id': 'nm5073050', 'name': 'Kaajal Pasupathi'}, {'id': 'nm0695177', 'name': 'Prakash Raj'}]",ta
"https://m.media-amazon.com/images/M/MV5BMjE2MTI3NDI0Ml5BMl5BanBnXkFtZTcwMDkzMTUyOQ@@._V1_UY98_CR53,0,67,98_AL_.jpg",tt2748544,A Gun & a Ring,2013,105.0,"Crime, Drama, War",6.2,,"Lives of seemingly ordinary people clash and change forever in interlocking tales of guilt, courage and passion.",122,"[{'id': 'nm3498134', 'name': 'Lenin M. Sivam'}]","[{'id': 'nm5620759', 'name': 'Kanthan Annalingam'}, {'id': 'nm5554075', 'name': 'Komeswaran Annalingam'}, {'id': 'nm5554614', 'name': 'Shelly Antony'}, {'id': 'nm6365866', 'name': 'Ruben Avila Aguilar'}]",ta
"https://m.media-amazon.com/images/M/MV5BYmU4MzFlOTQtMTIyYS00ZmQxLTg3OTYtYjM3YmM1NzFkZmJhXkEyXkFqcGdeQXVyODE4MTg5NjQ@._V1_UY98_CR0,0,67,98_AL_.jpg",tt2302966,I,2015,188.0,"Action, Drama, Romance",7.4,,A deformed hunchback kidnaps a bride on the day of her marriage and holds her hostage while his connection to her and his targets is revealed in a series of flashbacks that unfold as he starts seeking revenge.,22592,"[{'id': 'nm0788171', 'name': 'S. Shankar'}]","[{'id': 'nm1417314', 'name': 'Vikram'}, {'id': 'nm3367112', 'name': 'Amy Jackson'}, {'id': 'nm0329730', 'name': 'Suresh Gopi'}, {'id': 'nm1574606', 'name': 'Upen Patel'}]",ta
"https://m.media-amazon.com/images/M/MV5BMzc1NzgwMzgyM15BMl5BanBnXkFtZTgwMzAwMzQ1ODE@._V1_UX67_CR0,0,67,98_AL_.jpg",tt4082068,Dheepan,2015,115.0,"Crime, Drama",7.2,76,Dheepan is a Sri Lankan Tamil warrior who flees to France and ends up working as a caretaker outside Paris.,16436,"[{'id': 'nm0002191', 'name': 'Jacques Audiard'}]","[{'id': 'nm7316147', 'name': 'Jesuthasan Antonythasan'}, {'id': 'nm7316148', 'name': 'Kalieaswari Srinivasan'}, {'id': 'nm7316149', 'name': 'Claudine Vinasithamby'}, {'id': 'nm1196219', 'name': 'Vincent Rottiers'}]",ta
"https://m.media-amazon.com/images/M/MV5BNjI2Y2Q5ZGEtOGUzZS00NjY3LWE0N2UtZGQzNmFlZjFkYjA3XkEyXkFqcGdeQXVyODIwMDI1NjM@._V1_UY98_CR2,0,67,98_AL_.jpg",tt4991384,Visaaranai,2015,117.0,"Crime, Drama, Thriller",8.4,,Four labourers are tortured by the police to confess to a theft they have not committed.,11481,"[{'id': 'nm4274575', 'name': 'Vetrimaaran'}]","[{'id': 'nm5625923', 'name': 'Dinesh'}, {'id': 'nm2284321', 'name': 'Samuthirakani'}, {'id': 'nm6695317', 'name': 'Anandhi'}, {'id': 'nm4820548', 'name': 'Murugadass'}]",ta
"https://m.media-amazon.com/images/M/MV5BZjhkNmNjNGQtNjQ4My00MjFhLWIyNjUtZDExYzNjMDkyZjZiXkEyXkFqcGdeQXVyMTEzNzg0Mjkx._V1_UY98_CR9,0,67,98_AL_.jpg",tt5037912,Maya,2015,141.0,"Horror, Thriller",7.5,,"A woman takes on the challenge of watching a horror film, alone in a theatre.",1749,"[{'id': 'nm7594197', 'name': 'Ashwin Saravanan'}, {'id': 'nm14019476', 'name': 'Md. Hafizur Rahman'}]","[{'id': 'nm1521381', 'name': 'Nayanthara'}, {'id': 'nm5615313', 'name': 'Aari'}, {'id': 'nm12100203', 'name': 'Aari Arujunan'}, {'id': 'nm4831604', 'name': 'Amzath Khan'}]",ta
"https://m.media-amazon.com/images/M/MV5BMDgxZWFjOWItNDkxYS00NGJiLWJiZjUtOWJjYWJmOGNlYzc2XkEyXkFqcGdeQXVyMTEzNzg0Mjkx._V1_UY98_CR3,0,67,98_AL_.jpg",tt4806232,Indru Netru Naalai,2015,146.0,"Comedy, Sci-Fi, Thriller",8.0,,"Elango and his friend Pulivetti come into possession of a time machine and they start profiting from it. However, their meddling with time prevents the death of a gangster, who begins to wreak havoc in their lives.",4688,"[{'id': 'nm7415469', 'name': 'R. Ravikumar'}]","[{'id': 'nm3684167', 'name': 'Vishnu Vishal'}, {'id': 'nm5573352', 'name': 'Miya George'}, {'id': 'nm5369429', 'name': 'Karunakaran'}, {'id': 'nm3605032', 'name': 'T.M. Karthik Srinivasan'}]",ta
"https://m.media-amazon.com/images/M/MV5BMmRhZmJjNjgtZjVkNi00ODllLTg1OGQtMWE1NTZmNTRmYTM3XkEyXkFqcGdeQXVyMTEzNzg0Mjkx._V1_UY98_CR5,0,67,98_AL_.jpg",tt5124096,Thanga Magan,2015,122.0,"Action, Drama, Romance",6.0,,"Tamizh's peaceful life is shattered when his father commits suicide. So, he tries to uncover the reason that prompted his father to kill himself.",2419,"[{'id': 'nm1399485', 'name': 'Velraj'}]","[{'id': 'nm1333687', 'name': 'Dhanush'}, {'id': 'nm3606487', 'name': 'Samantha Ruth Prabhu'}, {'id': 'nm3367112', 'name': 'Amy Jackson'}, {'id': 'nm0433893', 'name': 'K.S. Ravikumar'}]",ta
"https://m.media-amazon.com/images/M/MV5BYTc0ODgyODMtYTU3OS00NDcxLWI3YmYtZGVjMWQxOGI2ODZiXkEyXkFqcGdeQXVyMTEzNzg0Mjkx._V1_UY98_CR5,0,67,98_AL_.jpg",tt4987556,Thani Oruvan,2015,160.0,"Action, Crime, Thriller",8.4,,"Siddharth Abimanyu, an influential scientist, is involved in various illegal medical practices. Mithran, an efficient IPS officer, decides to expose him.",20866,"[{'id': 'nm1001345', 'name': 'Mohan Raja'}]","[{'id': 'nm1865947', 'name': 'Jayam Ravi'}, {'id': 'nm0841552', 'name': 'Arvind Swami'}, {'id': 'nm1521381', 'name': 'Nayanthara'}, {'id': 'nm0621937', 'name': 'Nassar'}]",ta
"https://m.media-amazon.com/images/M/MV5BMTcyODc0NGEtZjEzZC00YmRlLWJiNGEtMjQ5MWVlN2U0ODZhXkEyXkFqcGdeQXVyODIwMDI1NjM@._V1_UX67_CR0,0,67,98_AL_.jpg",tt5128328,Naanum Rowdydhaan,2015,139.0,"Action, Comedy, Romance",7.2,,A wannabe rowdy who falls for a hearing-impaired girl faces a dilemma when the girl makes a shocking request.,4824,"[{'id': 'nm4174626', 'name': 'Vignesh Shivan'}]","[{'id': 'nm4043111', 'name': 'Vijay Sethupathi'}, {'id': 'nm1521381', 'name': 'Nayanthara'}, {'id': 'nm1011887', 'name': 'Parthiban Radhakrishnan'}, {'id': 'nm0704654', 'name': 'Radhika Sarathkumar'}]",ta
"https://m.media-amazon.com/images/M/MV5BYWY4NGM5N2MtODk2OC00Y2VjLWI0YWItMTc4MmIyMWY2OTJiXkEyXkFqcGdeQXVyMTEzNzg0Mjkx._V1_UY98_CR0,0,67,98_AL_.jpg",tt4271820,OK Kanmani,2015,139.0,Romance,7.4,,"Two young lovers are compatible in every way - they even agree that marriage is futile. However, their emotions are not so easily managed, especially when they witness the unconditional love of the older couple with whom they live.",6457,"[{'id': 'nm0711745', 'name': 'Mani Ratnam'}]","[{'id': 'nm4921260', 'name': 'Dulquer Salmaan'}, {'id': 'nm3383930', 'name': 'Nithya Menen'}, {'id': 'nm0695177', 'name': 'Prakash Raj'}, {'id': 'nm7118554', 'name': 'Leela Samson'}]",ta
"https://m.media-amazon.com/images/M/MV5BZmNmY2IxOGYtOGZjMy00NzZmLWFkMWEtNTY2NzVhZWMxMGQ3XkEyXkFqcGdeQXVyMTEzNzg0Mjkx._V1_UX67_CR0,0,67,98_AL_.jpg",tt4959326,Size Zero,2015,125.0,"Comedy, Romance",5.5,,"Sweety, an obese woman, is shocked when her friend falls sick after joining a slimming centre. So she begins a campaign to highlight the importance of being fit rather than slim.",893,"[{'id': 'nm1668634', 'name': 'Prakash Kovelamudi'}]","[{'id': 'nm2011932', 'name': 'Anushka Shetty'}, {'id': 'nm1951127', 'name': 'Arya'}, {'id': 'nm2978161', 'name': 'Sonal Chauhan'}, {'id': 'nm0882219', 'name': 'Urvashi'}]",ta
"https://m.media-amazon.com/images/M/MV5BY2Q2ZGU2NTMtMzJjNi00ZjdkLWFlNWMtZGExMjQ0NDEzNGIwXkEyXkFqcGdeQXVyMTEzNzg0Mjkx._V1_UY98_CR9,0,67,98_AL_.jpg",tt4047104,Enakkul Oruvan,2015,136.0,"Drama, Thriller",7.7,,"A man suffering from insomnia is tricked into buying a drug, Lucia, that makes his desires come true in his dreams, blurring the line between fantasy and reality.",1765,"[{'id': 'nm6780137', 'name': 'Prasad Ramar'}]","[{'id': 'nm1413459', 'name': 'Siddharth'}, {'id': 'nm4715473', 'name': 'Deepa Sannidhi'}, {'id': 'nm6686507', 'name': 'Srushti Dange'}, {'id': 'nm1559782', 'name': 'Ajay Ratnam'}]",ta
"https://m.media-amazon.com/images/M/MV5BMzM3ZTM1NjMtZjIxMi00MjM5LWE5ODEtOGJlYzFkNDFmYWU5XkEyXkFqcGdeQXVyMTEzNzg0Mjkx._V1_UX67_CR0,0,67,98_AL_.jpg",tt5266218,Bengal Tiger,2015,145.0,"Action, Comedy",5.2,,"Akash gets rejected by a girl because he isn't popular. Insulted, Akash starts doing whatever he can to become the talk of the town.",1022,"[{'id': 'nm4214524', 'name': 'Sampath Nandi'}]","[{'id': 'nm0712433', 'name': 'Ravi Teja'}, {'id': 'nm1961459', 'name': 'Tamannaah Bhatia'}, {'id': 'nm5637317', 'name': 'Raashi Khanna'}, {'id': 'nm0103977', 'name': 'Brahmanandam'}]",ta
"https://m.media-amazon.com/images/M/MV5BZjAzYzIwYzAtNmRiMC00ZmQ3LTgwMzAtODVhMDk3NTBmNWE4XkEyXkFqcGdeQXVyMTEzNzg0Mjkx._V1_UY98_CR6,0,67,98_AL_.jpg",tt4429128,Papanasam,2015,179.0,"Crime, Drama, Thriller",8.4,,Desperate measures are taken by a man who tries to save his family from the dark side of the law after they commit an unexpected crime.,7847,"[{'id': 'nm2572228', 'name': 'Jeethu Joseph'}]","[{'id': 'nm0352032', 'name': 'Kamal Haasan'}, {'id': 'nm0310221', 'name': 'Gautami'}, {'id': 'nm3223429', 'name': 'Nivetha Thomas'}, {'id': 'nm6189601', 'name': 'Esther Anil'}]",ta
"https://m.media-amazon.com/images/M/MV5BYjhkNDUyY2ItNjAxNi00MGFkLTk0YmQtNWRhZGEzNjk3MTQyXkEyXkFqcGdeQXVyMTEzNzg0Mjkx._V1_UY98_CR5,0,67,98_AL_.jpg",tt4546024,Komban,2015,136.0,"Action, Drama",5.8,,An angry young man tries to give up his violent ways after his marriage runs into trouble. But his nemesis will not rest until he is killed.,868,"[{'id': 'nm5709298', 'name': 'M. Muthaiah'}]","[{'id': 'nm1912683', 'name': 'Karthi'}, {'id': 'nm4363856', 'name': 'Raj Kiran'}, {'id': 'nm5068044', 'name': 'Lakshmi Menon'}, {'id': 'nm4446366', 'name': 'Thambi Ramaiah'}]",ta
"https://m.media-amazon.com/images/M/MV5BZGU0ODAxNDUtMDQ0Mi00MjhlLWFjZDYtYzMwMjFlNTI4OTA2XkEyXkFqcGdeQXVyMTEzNzg0Mjkx._V1_UY98_CR5,0,67,98_AL_.jpg",tt5029004,Trisha Illana Nayanthara,2015,130.0,"Comedy, Drama, Romance",5.1,,"Jeeva goes through 3 different stages of life - from school, to college and career. It talks about the views of youth on love. The story underlines the importance of not giving up hope after a break-up.",822,"[{'id': 'nm7587855', 'name': 'Adhik Ravichandran'}]","[{'id': 'nm1574854', 'name': 'G.V. Prakash Kumar'}, {'id': 'nm6695317', 'name': 'Anandhi'}, {'id': 'nm5043023', 'name': 'Manisha Yadav'}, {'id': 'nm0801264', 'name': 'Simran'}]",ta
"https://m.media-amazon.com/images/M/MV5BMGU3Nzk1YTktMzBkZC00ZTk2LWE2MjQtM2M0NDY3MDIxOTEwXkEyXkFqcGdeQXVyMTEzNzg0Mjkx._V1_UY98_CR1,0,67,98_AL_.jpg",tt5178278,Vedalam,2015,148.0,"Action, Drama",6.3,,A doting brother who works as a cab driver tries to hunt down three notorious criminals in Kolkata who had harmed his sister.,7957,"[{'id': 'nm2350892', 'name': 'Siva'}]","[{'id': 'nm0015001', 'name': 'Ajith Kumar'}, {'id': 'nm1599046', 'name': 'Shruti Haasan'}, {'id': 'nm5068044', 'name': 'Lakshmi Menon'}, {'id': 'nm4262344', 'name': 'Soori'}]",ta
"https://m.media-amazon.com/images/M/MV5BOTk2NjQxNzYtNDMxNS00MzQ1LTkzNDMtOWQwYWY4OGE4OGU5XkEyXkFqcGdeQXVyMTEzNzg0Mjkx._V1_UY98_CR2,0,67,98_AL_.jpg",tt4937812,Thoongaavanam,2015,128.0,"Action, Crime, Thriller",6.9,,"A cop with a connection to the criminal underworld finds his secret life exposed when he and his partner are caught stealing cocaine from a powerful drug dealer, a move that puts his son's life in jeopardy.",2486,"[{'id': 'nm4301161', 'name': 'Rajesh M. Selva'}]","[{'id': 'nm0352032', 'name': 'Kamal Haasan'}, {'id': 'nm0695177', 'name': 'Prakash Raj'}, {'id': 'nm1375534', 'name': 'Trisha Krishnan'}, {'id': 'nm3132784', 'name': 'Kishore Kumar G.'}]",ta
"https://m.media-amazon.com/images/M/MV5BZmU0NzUyN2QtOThmNC00YzcwLWE5MmEtM2E2YTE4N2I0ZDYzXkEyXkFqcGdeQXVyMTEzNzg0Mjkx._V1_UY98_CR0,0,67,98_AL_.jpg",tt4995748,Paayum Puli,2015,135.0,"Action, Crime, Thriller",6.1,,A cop mistakenly believes that taking out three thugs will end Madurai's crime wave.,994,"[{'id': 'nm3607398', 'name': 'Suseenthiran'}]","[{'id': 'nm1953187', 'name': 'Vishal'}, {'id': 'nm2570245', 'name': 'Kajal Aggarwal'}, {'id': 'nm2284321', 'name': 'Samuthirakani'}, {'id': 'nm4262344', 'name': 'Soori'}]",ta
"https://m.media-amazon.com/images/M/MV5BYTk4NTllMGUtNGZmYi00YTViLTgyMjctZWE4ODNiMTcyOGYzXkEyXkFqcGdeQXVyMTEzNzg0Mjkx._V1_UY98_CR3,0,67,98_AL_.jpg",tt4401884,Isai,2015,190.0,"Musical, Romance, Thriller",6.4,,"A maestro decides to snuff out his subordinate, after the latter subdued all his fame.",680,"[{'id': 'nm0754184', 'name': 'S.J. Suryah'}]","[{'id': 'nm0754184', 'name': 'S.J. Suryah'}, {'id': 'nm0766470', 'name': 'Sathyaraj'}, {'id': 'nm4540889', 'name': 'Sulagna Panigrahi'}, {'id': 'nm4446366', 'name': 'Thambi Ramaiah'}]",ta
"https://m.media-amazon.com/images/M/MV5BMjdkNGJjYjctYTJkYS00ZWM4LWEwZTItOWE3N2U0ZTQ1ZjMzXkEyXkFqcGdeQXVyMTEzNzg0Mjkx._V1_UY98_CR8,0,67,98_AL_.jpg",tt5285050,Pasanga 2,2015,127.0,Drama,7.3,,"It focuses on the issue of Attention Deficit Hyperactive Disorder (ADHD) among children, and the impact of the disorder on their lives and people around them.",1703,"[{'id': 'nm4242010', 'name': 'Pandiraj'}]","[{'id': 'nm1421814', 'name': 'Suriya'}, {'id': 'nm3898762', 'name': 'Amala Paul'}, {'id': 'nm7809884', 'name': 'Nishesh'}, {'id': 'nm5297321', 'name': 'Baby Vaishnavi'}]",ta
"https://m.media-amazon.com/images/M/MV5BMzk3OTRjNGQtMmVhOS00YjY0LWE5MDUtMDRkNjY0Yzg1ZTdjXkEyXkFqcGdeQXVyMTEzNzg0Mjkx._V1_UY98_CR6,0,67,98_AL_.jpg",tt5128266,10 Endrathukulla,2015,144.0,"Action, Adventure, Thriller",5.2,,"An enigmatic driving instructor is assigned the task of travelling with a woman and safely delivering her at a certain location. However, when he learns a terrible secret and the fact that her life is in danger, he must become her saviour.",1518,"[{'id': 'nm1703877', 'name': 'Vijay Milton'}]","[{'id': 'nm1417314', 'name': 'Vikram'}, {'id': 'nm3606487', 'name': 'Samantha Ruth Prabhu'}, {'id': 'nm1367730', 'name': 'Pasupathy'}, {'id': 'nm0222144', 'name': 'Rahul Dev'}]",ta
"https://m.media-amazon.com/images/M/MV5BYzAzZTgyZTEtNGIwZi00NmIyLWI4YTYtZjJiYzQyNTRhODVkXkEyXkFqcGdeQXVyMTEzNzg0Mjkx._V1_UY98_CR11,0,67,98_AL_.jpg",tt4312676,Aambala,2015,146.0,"Action, Comedy",4.7,,"Saravanan and his two brothers go to their native village to make peace between their estranged father and three aunts, who hate their brother for having murdered their father.",1197,"[{'id': 'nm1326535', 'name': 'Sundar C.'}]","[{'id': 'nm1953187', 'name': 'Vishal'}, {'id': 'nm1394426', 'name': 'Hansika Motwani'}, {'id': 'nm0694893', 'name': 'Prabhu'}, {'id': 'nm3163817', 'name': 'Vaibhav Reddy'}]",ta
"https://m.media-amazon.com/images/M/MV5BOTQwMjYzOWYtNjc2My00MDVhLWIzZWYtYWNkODViOGQyZDRmXkEyXkFqcGdeQXVyMTEzNzg0Mjkx._V1_UY98_CR6,0,67,98_AL_.jpg",tt4446258,Romeo Juliet,2015,150.0,"Comedy, Romance",5.7,,"Karthik chases after Aishwarya, but she ditches him when she realizes he's a pauper. Karthik doesn't give up easily though so Aishwarya has to find other ways to shake him off.",1338,"[{'id': 'nm7121260', 'name': 'Lakshman'}]","[{'id': 'nm1865947', 'name': 'Jayam Ravi'}, {'id': 'nm1394426', 'name': 'Hansika Motwani'}, {'id': 'nm5115608', 'name': 'Vamsi Krishna'}, {'id': 'nm2465676', 'name': 'Poonam Bajwa'}]",ta
"https://m.media-amazon.com/images/M/MV5BYzZiY2ZhOGQtZjEwOC00NzhmLTk2MDYtOTNhYzUzY2U2OTFlXkEyXkFqcGdeQXVyMTEzNzg0Mjkx._V1_UY98_CR2,0,67,98_AL_.jpg",tt4446318,Rajathandhiram,2015,132.0,"Action, Crime, Thriller",7.6,,Small-time criminals plan a big-time heist. Will they be successful in their attempt ?,1438,"[{'id': 'nm7121331', 'name': 'A.G. Amid'}]","[{'id': 'nm3835651', 'name': 'Veera Bahu'}, {'id': 'nm5294556', 'name': 'Regina Cassandra'}, {'id': 'nm7121333', 'name': 'Pattiyal K. Shekar'}, {'id': 'nm4254923', 'name': 'Darbuka Siva'}]",ta
"https://m.media-amazon.com/images/M/MV5BM2IyNjUzOTctZDUwMi00MTgwLWI1MDUtMTJjNmQzZDMzYjk1XkEyXkFqcGdeQXVyMTEzNzg0Mjkx._V1_UY98_CR6,0,67,98_AL_.jpg",tt3557988,Boologam,2015,143.0,"Action, Sport",5.7,,"The families of Boologam and Arumugam, two boxers, have been rivals for many years. Deepak, a businessman, decides to use this rivalry for his personal gain.",873,"[{'id': 'nm6314940', 'name': 'N. Kalyanakrishnan'}]","[{'id': 'nm1865947', 'name': 'Jayam Ravi'}, {'id': 'nm1375534', 'name': 'Trisha Krishnan'}, {'id': 'nm0695177', 'name': 'Prakash Raj'}, {'id': 'nm0428923', 'name': 'Nathan Jones'}]",ta
"https://m.media-amazon.com/images/M/MV5BM2RjNTFjMzktZGZlYi00ZGRmLWIyZWItNzJkZDZlZjM5MWEwXkEyXkFqcGdeQXVyMTEzNzg0Mjkx._V1_UY98_CR6,0,67,98_AL_.jpg",tt3681422,Uttama Villain,2015,171.0,"Comedy, Drama",7.3,,"Manoranjan, a superstar, is counting his last days due to brain tumor. How he goes about his final wish of doing a comedy film with his mentor Margadarsi forms the crux of the story.",3540,"[{'id': 'nm0033243', 'name': 'Ramesh Aravind'}]","[{'id': 'nm0352032', 'name': 'Kamal Haasan'}, {'id': 'nm0049335', 'name': 'K. Balachander'}, {'id': 'nm0899649', 'name': 'K. Viswanath'}, {'id': 'nm0621937', 'name': 'Nassar'}]",ta
"https://m.media-amazon.com/images/M/MV5BYzc2MWY3ODAtMTIzZC00YTAwLWE0ZGItYTg5ODkwNTMxMDJjXkEyXkFqcGdeQXVyODIwMDI1NjM@._V1_UY98_CR2,0,67,98_AL_.jpg",tt4258292,Yennai Arindhaal,2015,168.0,"Action, Crime, Drama",7.3,,"Sathyadev, a sincere police officer, tries to stop an organ trafficking racket. But he is unaware that the man performing the illegal trade is the same person who killed his beloved.",10060,"[{'id': 'nm1069826', 'name': 'Gautham Vasudev Menon'}]","[{'id': 'nm0015001', 'name': 'Ajith Kumar'}, {'id': 'nm4521975', 'name': 'Arun Vijay'}, {'id': 'nm1375534', 'name': 'Trisha Krishnan'}, {'id': 'nm2011932', 'name': 'Anushka Shetty'}]",ta
"https://m.media-amazon.com/images/M/MV5BNzk2NjU5NzEtMjQyYS00ZGM1LTgzM2ItNmI3NzJhMzk3NDY5XkEyXkFqcGdeQXVyODIwMDI1NjM@._V1_UX67_CR0,0,67,98_AL_.jpg",tt4415326,Kaaki Sattai,2015,156.0,Action,5.7,,A young cop needs to show his true potential to catch a gangster and to win his love.,1635,"[{'id': 'nm10833353', 'name': 'Harish Ram L.H.'}, {'id': 'nm5650556', 'name': 'R.S. Durai Senthilkumar'}]","[{'id': 'nm4792434', 'name': 'Sivakarthikeyan'}, {'id': 'nm0694893', 'name': 'Prabhu'}, {'id': 'nm4248233', 'name': 'Sri Divya'}, {'id': 'nm0704694', 'name': 'Vijay Raaz'}]",ta
"https://m.media-amazon.com/images/M/MV5BNDNmMDM4Y2UtMTYxNi00MjVkLThjNmYtYzk3M2YyOTFjMWZmXkEyXkFqcGdeQXVyMTEzNzg0Mjkx._V1_UY98_CR3,0,67,98_AL_.jpg",tt4922694,Vasuvum Saravananum Onna Padichavanga,2015,147.0,Comedy,4.5,,"Vasu (Santhanam) and Saravanan(Arya) are close buddies who run a mobile shop. But when two girls Seema (Banu) and Aishwarya (Tamannaah) enter their life, life changes. How Vasu and Saravanan struggle to keep their friendship going ?",667,"[{'id': 'nm3578957', 'name': 'M. Rajesh'}]","[{'id': 'nm1951127', 'name': 'Arya'}, {'id': 'nm1962272', 'name': 'Santhanam'}, {'id': 'nm1961459', 'name': 'Tamannaah Bhatia'}, {'id': 'nm2522571', 'name': 'Muktha George'}]",ta
