poster,imdb-id,title,release-year,runtime,genre,imdb-rating,metascore,overview,votes,directors,cast,language
"https://m.media-amazon.com/images/M/MV5BM2I2NjExYTYtNmFhYi00ODczLThlZGItODFmOGNkMWM5NWU4XkEyXkFqcGdeQXVyMTEzNzg0Mjkx._V1_UY98_CR2,0,67,98_AL_.jpg",tt6998596,Rangoon,2017,126.0,"Action, Crime, Drama",7.0,,A story about three friends dealing illegal gold trafficking in India and when they think everything is going smoothly their life takes a u-turn when a business deal goes wrong in Rangoon,679,"[{'id': 'nm9055195', 'name': 'Rajkumar Periasamy'}]","[{'id': 'nm5221962', 'name': 'Gautham Karthik'}, {'id': 'nm7945853', 'name': 'Sana Khan'}, {'id': 'nm9055196', 'name': 'Lallu'}, {'id': 'nm4975518', 'name': 'Prashant Nair'}]",ta
"https://m.media-amazon.com/images/M/MV5BZjc5YzI5ODQtZGQwYi00MWE5LWJkYzUtZDNlNDNmZTVkODhhXkEyXkFqcGdeQXVyODIwMDI1NjM@._V1_UY98_CR3,0,67,98_AL_.jpg",tt7080686,Sathya,2017,127.0,"Action, Crime, Thriller",6.3,,"Sathya, the protagonist goes back to india on request of her Ex and helps her in finding her missed daughter, which leads to twists and turns!",407,"[{'id': 'nm8614207', 'name': 'Pradeep Krishnamoorthy'}]","[{'id': 'nm4971960', 'name': 'Sibiraj'}, {'id': 'nm2463487', 'name': 'Ramya Nambeeshan'}, {'id': 'nm1686962', 'name': 'Anandraj'}, {'id': 'nm6489058', 'name': 'Yogi Babu'}]",ta
"https://m.media-amazon.com/images/M/MV5BNDg5OTRiNGUtYTJjZi00ZjcxLTlmOWEtNDVjM2YwMDdjMjU2XkEyXkFqcGdeQXVyMTEzNzg0Mjkx._V1_UY98_CR3,0,67,98_AL_.jpg",tt6735094,Sathriyan,2017,156.0,Action,4.8,,"Guna is local thug who is serious about the gangster life. When love enters his life, Guna is not ready to give up on love so he decides to reform his ways and settle down in the family life.",172,"[{'id': 'nm11066286', 'name': 'S.R. Prabhakaran'}]","[{'id': 'nm5076645', 'name': 'Vikram Prabhu'}, {'id': 'nm1617813', 'name': 'Manjima Mohan'}, {'id': 'nm9066645', 'name': 'Kavin'}, {'id': 'nm3598615', 'name': 'Aishwarya Dutta'}]",ta
"https://m.media-amazon.com/images/M/MV5BY2Y3YWE3ZWUtOTYyNC00YzlkLWFlNmItMGVjNTI0YzcyY2QyXkEyXkFqcGdeQXVyMTEzNzg0Mjkx._V1_UY98_CR3,0,67,98_AL_.jpg",tt6904340,Sangili Bungili Kadhava Thorae,2017,140.0,"Comedy, Horror",5.3,,"A young man who vows to buy a mansion of his own, moves his extended family into it without knowing that it is haunted.",466,"[{'id': 'nm4874923', 'name': 'Ike'}]","[{'id': 'nm5605460', 'name': 'Nivas Adithan'}, {'id': 'nm2011414', 'name': 'Devadarshini Chetan'}, {'id': 'nm4248233', 'name': 'Sri Divya'}, {'id': 'nm4114567', 'name': 'Akshara Gowda'}]",ta
"https://m.media-amazon.com/images/M/MV5BYzZmNzQxNDAtNzI3My00NjFjLWIwMDgtZTZmNWUxYTlkMzE4XkEyXkFqcGdeQXVyODIwMDI1NjM@._V1_UY98_CR2,0,67,98_AL_.jpg",tt5902484,Kaatru Veliyidai,2017,146.0,"Action, Drama, Romance",5.8,,Fighter pilot Varun recalls his romance with Leela while being held prisoner in Pakistan during the Kargil War.,2322,"[{'id': 'nm0711745', 'name': 'Mani Ratnam'}]","[{'id': 'nm1912683', 'name': 'Karthi'}, {'id': 'nm2390814', 'name': 'Aditi Rao Hydari'}, {'id': 'nm7744845', 'name': 'Shraddha Srinath'}, {'id': 'nm5657068', 'name': 'RJ Balaji'}]",ta
"https://m.media-amazon.com/images/M/MV5BZWY2MjNjNjctODg1ZC00ZWU0LTk5MjctMDdjYTYzMjRhZGY3XkEyXkFqcGdeQXVyMTEzNzg0Mjkx._V1_UY98_CR6,0,67,98_AL_.jpg",tt6237984,Magalir Mattum,2017,140.0,Drama,6.3,,Three best friends from school reunite after 36 years.,591,"[{'id': 'nm6836445', 'name': 'Bramma G.'}]","[{'id': 'nm0433392', 'name': 'Jyotika'}, {'id': 'nm0882219', 'name': 'Urvashi'}, {'id': 'nm0764853', 'name': 'Saranya Ponvannan'}, {'id': 'nm0080228', 'name': 'Bhanupriya'}]",ta
"https://m.media-amazon.com/images/M/MV5BYjIzM2ZhN2MtMDg0YS00MDhjLWJiMGMtNGY0Zjg4ZmQ5YjAxXkEyXkFqcGdeQXVyMTEzNzg0Mjkx._V1_UY98_CR4,0,67,98_AL_.jpg",tt7221950,Neruppuda,2017,127.0,Action,4.5,,"Vikram Prabhu stars as a firefighter, who is also a hardcore Rajinikanth fan, in this film directed by B. Ashok Kumar.",153,[],[],ta
"https://m.media-amazon.com/images/M/MV5BYmQxZDgxYWMtYmYwZi00OWJhLWFmYmItNjIzZTA5MGUyMTY2XkEyXkFqcGdeQXVyODk2ODI3MTU@._V1_UX67_CR0,0,67,98_AL_.jpg",tt6998630,Uru,2017,111.0,Thriller,5.8,,"The story revolves around a writer who becomes outdated due to changing trends. He decides to leave for Megamalai to find solitude and write a new book. Upon arrival to Megamalai, ...                See full summary »",349,"[{'id': 'nm9055213', 'name': 'Vicky Anand'}]","[{'id': 'nm4734130', 'name': 'Dhansika'}, {'id': 'nm6504384', 'name': 'Mime Gopi'}, {'id': 'nm4278537', 'name': 'Jayabalan'}, {'id': 'nm5296909', 'name': 'Kalaiyarasan'}]",ta
"https://m.media-amazon.com/images/M/MV5BM2U2YjZjY2EtYWNhNy00YzAyLTgyYjEtNWJkNWFmM2MzZTk1XkEyXkFqcGdeQXVyMTEzNzg0Mjkx._V1_UY98_CR5,0,67,98_AL_.jpg",tt7161122,Meesaya murukku,2017,131.0,"Biography, Comedy, Drama",7.5,,"A semi-biopic of how India's first Tamil Hip-Hop band, Hip-hop Tamizha came to be and the struggles frontman Adhi faced in life, both in personal and professional frontiers.",2698,"[{'id': 'nm5657066', 'name': 'Hiphop Tamizha Adhi'}]","[{'id': 'nm5657066', 'name': 'Hiphop Tamizha Adhi'}, {'id': 'nm9164560', 'name': 'Aathmika'}, {'id': 'nm7953789', 'name': 'Ma ka Pa Anand'}, {'id': 'nm9164567', 'name': 'Thameem Ansari'}]",ta
"https://m.media-amazon.com/images/M/MV5BOGM5NzM5MzEtY2Q2Mi00YzBhLWIyYWYtNTc0OTRmN2M4NWNjXkEyXkFqcGdeQXVyMTEzNzg0Mjkx._V1_UY98_CR1,0,67,98_AL_.jpg",tt7087934,Ivan Thanthiran,2017,114.0,"Action, Comedy",6.3,,Two engineering dropouts stumble upon the activities of a corrupt education minister owning engineering colleges and expose him. The minister wants revenge and launches a manhunt for them. The cat-and-mouse game begins.,639,"[{'id': 'nm1583171', 'name': 'R. Kannan'}]","[{'id': 'nm5657068', 'name': 'RJ Balaji'}, {'id': 'nm1485941', 'name': 'Madhan Bob'}, {'id': 'nm5221962', 'name': 'Gautham Karthik'}, {'id': 'nm1416319', 'name': 'Mayilsamy'}]",ta
"https://m.media-amazon.com/images/M/MV5BMWFmYmQ5NzYtMTdiNS00N2QxLThlYjMtMDcwMWNkNWNjODFjXkEyXkFqcGdeQXVyMTEzNzg0Mjkx._V1_UY98_CR1,0,67,98_AL_.jpg",tt5323640,Singam 3,2017,155.0,"Action, Crime, Thriller",6.0,,Uncompromising police chief Durai Singam battles against a criminal operation dealing in deadly toxic waste.,6843,"[{'id': 'nm14008738', 'name': 'P.H. Kumanan'}, {'id': 'nm1419055', 'name': 'Hari'}]","[{'id': 'nm1421814', 'name': 'Suriya'}, {'id': 'nm2011932', 'name': 'Anushka Shetty'}, {'id': 'nm1599046', 'name': 'Shruti Haasan'}, {'id': 'nm5990156', 'name': 'Thakur Anoop Singh'}]",ta
"https://m.media-amazon.com/images/M/MV5BMGJkN2MzOGYtOGMxOC00ODc3LTkzZmEtMzVkZGU2OTgyOTJjXkEyXkFqcGdeQXVyMTEzNzg0Mjkx._V1_UY98_CR4,0,67,98_AL_.jpg",tt7297844,Kathanayagan,2017,122.0,Comedy,4.5,,"The romantic comedy stars Vishnu and Catherine Tresa as a loving couple. Vishnu's character faces a problem, however, as he has to try hard to win the approval of his girlfriend's father.",242,"[{'id': 'nm9789662', 'name': 'Tha. Muruganatham'}]","[{'id': 'nm3684167', 'name': 'Vishnu Vishal'}, {'id': 'nm5528429', 'name': 'Catherine Tresa'}, {'id': 'nm1686962', 'name': 'Anandraj'}, {'id': 'nm4262344', 'name': 'Soori'}]",ta
"https://m.media-amazon.com/images/M/MV5BZWUxY2UxMzItZGQ2MS00NGU1LTk3ZjctZmIzZDU4NTljOGYzXkEyXkFqcGdeQXVyMTEzNzg0Mjkx._V1_UY98_CR3,0,67,98_AL_.jpg",tt7088096,Hara Hara Mahadevaki,2017,140.0,"Comedy, Romance",5.3,,"A coming-of-age film that centres on a loving couple. The film follows the couple's romantic relationship and eventually, their breakup with each other.",537,"[{'id': 'nm9103190', 'name': 'Santhosh P. Jayakumar'}]","[{'id': 'nm5221962', 'name': 'Gautham Karthik'}, {'id': 'nm6264784', 'name': 'Nikki Galrani'}, {'id': 'nm3951906', 'name': 'Sathish'}, {'id': 'nm5369429', 'name': 'Karunakaran'}]",ta
"https://m.media-amazon.com/images/M/MV5BNDJhZWIwNGYtZWE0NC00MGRmLTgwMWQtMjFjNDY0NDEzOGFkXkEyXkFqcGdeQXVyMTEzNzg0Mjkx._V1_UY98_CR4,0,67,98_AL_.jpg",tt6763794,Thondan,2017,138.0,Crime,6.1,,"Vishnu and Xavier are two individuals who work at a medical facility organization called ""UYIR"".",276,"[{'id': 'nm2284321', 'name': 'Samuthirakani'}]","[{'id': 'nm11982931', 'name': 'Gouri Nair'}, {'id': 'nm7848051', 'name': 'Arthana Binu'}, {'id': 'nm4787081', 'name': 'Gnanasambandam Gurunathan'}, {'id': 'nm2128968', 'name': ""'Ganja' Karuppu""}]",ta
"https://m.media-amazon.com/images/M/MV5BZTY4MTQyNDgtMDRkZC00Y2I5LTk5ZDUtYTM0ODg1Y2IyNmU5XkEyXkFqcGdeQXVyMTEzNzg0Mjkx._V1_UY98_CR10,0,67,98_AL_.jpg",tt6760704,Brindavanam,2017,170.0,Drama,6.7,,"A hearing and speech impaired barber in Ooty meets his idol, actor Vivekh. A poignant friendship develops between the two.",217,"[{'id': 'nm1701255', 'name': 'Radha Mohan'}]","[{'id': 'nm4650730', 'name': 'Arulnithi'}, {'id': 'nm0900266', 'name': 'Vivek'}, {'id': 'nm8682329', 'name': 'Tanya S Ravichandran'}, {'id': 'nm2132667', 'name': 'M.S. Bhaskar'}]",ta
"https://m.media-amazon.com/images/M/MV5BMzQyODhkYmEtODY4Zi00YTBhLThkMTktNzU2YzFmYjYyZTNiXkEyXkFqcGdeQXVyMzIwMTUxODA@._V1_UX67_CR0,0,67,98_AL_.jpg",tt7681554,Yazh,2017,125.0,"Romance, Thriller, War",9.4,,The Film narrates in real time in a non-linear fashion three interwoven stories of six main characters that are torn apart by the looming Lankan Eelam War.,183,"[{'id': 'nm9448910', 'name': 'M.S. Anand'}]","[{'id': 'nm5967305', 'name': 'Vinoth Kishan'}, {'id': 'nm1422363', 'name': 'Daniel Balaji'}, {'id': 'nm4367928', 'name': 'Misha Ghoshal'}, {'id': 'nm1416910', 'name': 'Sashikumar'}]",ta
"https://m.media-amazon.com/images/M/MV5BMjczYWM2MTgtNzNlYS00YzBjLTgwZmUtNjY5N2ZiYTFhMjVmXkEyXkFqcGdeQXVyMTEzNzg0Mjkx._V1_UY98_CR1,0,67,98_AL_.jpg",tt7041458,Balloon,2017,146.0,"Horror, Thriller",4.6,,Jeeva heads to a haunted house in Ooty where strange events start unfolding around him. The answer to which may lie in his past.,354,"[{'id': 'nm9078761', 'name': 'Sinish'}]","[{'id': 'nm3592766', 'name': 'Anjali'}, {'id': 'nm6489058', 'name': 'Yogi Babu'}, {'id': 'nm6670078', 'name': 'Ramachandran Durairaj'}, {'id': 'nm3817633', 'name': 'Janani Iyer'}]",ta
"https://m.media-amazon.com/images/M/MV5BYzA4MjBjZWUtNjcyZi00NWZmLThmODAtYmMyMjgzYTdlYWM5XkEyXkFqcGdeQXVyMTEzNzg0Mjkx._V1_UY98_CR11,0,67,98_AL_.jpg",tt6493974,Enakku Vaaitha Adimaigal,2017,135.0,"Comedy, Drama",5.8,,"The movie tells the story of Krishna - an IT professional, and the story narrates the two phases of his life - the first when he falls in love, and the second after his break-up.",244,"[{'id': 'nm8753737', 'name': 'Mahendran Rajamani'}]","[{'id': 'nm0415773', 'name': 'Jai'}, {'id': 'nm3912256', 'name': 'Pranitha'}, {'id': 'nm5369429', 'name': 'Karunakaran'}, {'id': 'nm6106360', 'name': 'Kaali Venkat'}]",ta
"https://m.media-amazon.com/images/M/MV5BZjdmNjcyNzAtNTM2YS00YTNjLTlmMTctYjFhYmI4YTQxZWY4XkEyXkFqcGdeQXVyMTEzNzg0Mjkx._V1_UY98_CR0,0,67,98_AL_.jpg",tt7297586,Richie,2017,111.0,"Action, Crime",5.1,,"A journalist sets out to uncover the truth behind an incident, through the perspectives of different people, unraveling how they and their lives are intertwined with it.",838,"[{'id': 'nm5297965', 'name': 'Gautham Ramachandran'}]","[{'id': 'nm4028885', 'name': 'Nivin Pauly'}, {'id': 'nm0836991', 'name': 'Nataraja Subramanian'}, {'id': 'nm7744845', 'name': 'Shraddha Srinath'}, {'id': 'nm0695177', 'name': 'Prakash Raj'}]",ta
"https://m.media-amazon.com/images/M/MV5BN2RlY2VjM2QtMTA1OC00N2ZmLTg5NzMtNGQwNjQ5NmFjNWNjXkEyXkFqcGdeQXVyNzgzNDA4OTk@._V1_UX67_CR0,0,67,98_AL_.jpg",tt7087944,Pandigai,2017,150.0,"Action, Romance, Thriller",6.4,,"A low-level hotel worker gets involved in a street fighting racket on the advice of a compulsive gambler. When the duo realise they have been duped by the gangster controlling the racket, they decided to rob him.",293,"[{'id': 'nm9103051', 'name': 'Feroz'}]","[{'id': 'nm9103052', 'name': 'Kreshna'}, {'id': 'nm6695317', 'name': 'Anandhi'}, {'id': 'nm1422741', 'name': 'Saravanan'}, {'id': 'nm3164309', 'name': 'Nitin Sathya'}]",ta
"https://m.media-amazon.com/images/M/MV5BYTZhYzFjNTYtNjc1Yi00MDAyLWE1NmUtNzBmMDM3ZDIwMzI0XkEyXkFqcGdeQXVyMTEzNzg0Mjkx._V1_UY98_CR6,0,67,98_AL_.jpg",tt6642814,Kadugu,2017,115.0,Drama,7.4,,A man goes up against corrupt and powerful people to avenge the crime committed against a child.,559,"[{'id': 'nm1703877', 'name': 'Vijay Milton'}]","[{'id': 'nm6836447', 'name': 'Radhika Prasidhha'}, {'id': 'nm5256621', 'name': 'Rajakumaran'}, {'id': 'nm1467000', 'name': 'Bharath Srinivasan'}, {'id': 'nm6327470', 'name': 'Subiksha'}]",ta
"https://m.media-amazon.com/images/M/MV5BYmYzNmFmMjgtNTg0MC00MDUzLWJmYzYtMzZkYWY4MzA0OTc3XkEyXkFqcGdeQXVyMTEzNzg0Mjkx._V1_UY98_CR7,0,67,98_AL_.jpg",tt7023500,Nenjil Thunivirundhal,2017,133.0,"Action, Drama",5.5,,An easygoing youngster's life is disturbed with the entry of a local don.,237,"[{'id': 'nm3607398', 'name': 'Suseenthiran'}]","[{'id': 'nm3807965', 'name': 'Sundeep Kishan'}, {'id': 'nm7917311', 'name': 'Mehreen Pirzada'}, {'id': 'nm5623923', 'name': 'Satya'}, {'id': 'nm5990227', 'name': 'Vikranth'}]",ta
"https://m.media-amazon.com/images/M/MV5BZTQ4N2QwOGMtN2E3OC00YTM0LTliOTUtOGQ2OTM2MWNhMGVkXkEyXkFqcGdeQXVyMjA4NjIzMTA@._V1_UY98_CR1,0,67,98_AL_.jpg",tt5254636,Dream Factory,2017,98.0,"Drama, Family",6.4,,Electricity is scarce and a problem that persists all over India. This is a story of a school drop-out trying to find a solution to the electricity problem. Science and innovation are the backdrops set in a rural background.,145,"[{'id': 'nm7775712', 'name': 'Arun Chidambaram'}]","[{'id': 'nm7775712', 'name': 'Arun Chidambaram'}, {'id': 'nm4828613', 'name': 'T.P. Gajendran'}, {'id': 'nm4787081', 'name': 'Gnanasambandam Gurunathan'}, {'id': 'nm7167453', 'name': 'M. Ilavarasu'}]",ta
"https://m.media-amazon.com/images/M/MV5BMmJiOGM1NjEtZDQxNS00ZWQ0LWIyNzMtZGIxMTQ2ZjRhNzkzXkEyXkFqcGdeQXVyNTM0MDc1ODE@._V1_UX67_CR0,0,67,98_AL_.jpg",tt6998580,Bongu,2017,124.0,Crime,5.0,,Three ex-salesman plan the ultimate car heist.,114,"[{'id': 'nm9055188', 'name': 'Taj'}]","[{'id': 'nm0836991', 'name': 'Nataraja Subramanian'}, {'id': 'nm5065283', 'name': 'Ruhi Singh'}, {'id': 'nm12814625', 'name': 'Manishaa Shree'}, {'id': 'nm7992234', 'name': 'Arjunan Nandakumar'}]",ta
"https://m.media-amazon.com/images/M/MV5BN2Q2N2M0NTUtZjgwZi00ZTE0LTgxYWEtN2MzNWYyNjFlN2Q2XkEyXkFqcGdeQXVyMzYxOTQ3MDg@._V1_UY98_CR3,0,67,98_AL_.jpg",tt7425474,Kadhal Kasakuthaiya,2017,137.0,"Drama, Romance",6.8,,"A coming of age tale of a young girl who falls in love with an IT guy, 8 years elder to her.",127,"[{'id': 'nm9301319', 'name': 'Dwarakh Raja'}]","[{'id': 'nm9301321', 'name': 'Venba'}, {'id': 'nm1706602', 'name': 'Charlie'}, {'id': 'nm9301320', 'name': 'Dhruvva'}, {'id': 'nm9301323', 'name': 'Jayaganesh'}]",ta
"https://m.media-amazon.com/images/M/MV5BZjhkNDczNDYtMDAyZi00MDIwLWE5ZGEtNzAzMjU0NGEwNDBiXkEyXkFqcGdeQXVyMTEzNzg0Mjkx._V1_UY98_CR20,0,67,98_AL_.jpg",tt6567380,Pagadi Aattam,2017,129.0,Crime,6.1,,An investigating officer stirs into action and looks into a series of cybercrimes after several innocent women are targeted by the offenders.,102,"[{'id': 'nm8803686', 'name': 'Ram K. Chandran'}]","[{'id': 'nm0706721', 'name': 'Rahman'}, {'id': 'nm4991185', 'name': 'Gowri Nandha'}, {'id': 'nm8803688', 'name': 'Surendar'}, {'id': 'nm10799726', 'name': 'Monica Chinnakotla'}]",ta
"https://m.media-amazon.com/images/M/MV5BOTJhNGJiZTMtMjIyYy00ZjFkLWFiMGMtZTFmZWJjZmRjMWQ0XkEyXkFqcGdeQXVyMTEzNzg0Mjkx._V1_UY98_CR1,0,67,98_AL_.jpg",tt6594820,Mupparimanam,2017,141.0,"Romance, Thriller",4.8,,This story of love and death follows Kathir and Anusha from their school days to their marriage.,117,"[{'id': 'nm8818829', 'name': 'Adhiroopan'}]","[{'id': 'nm5615313', 'name': 'Aari'}, {'id': 'nm2908893', 'name': 'Premgi Amaren'}, {'id': 'nm2537099', 'name': 'Vijay Antony'}, {'id': 'nm4474201', 'name': 'Appukutty'}]",ta
"https://m.media-amazon.com/images/M/MV5BMDMzMmNiZGMtY2UwYi00M2Y3LWIyYjAtZTMzNzg4ZmJiNTI3XkEyXkFqcGdeQXVyNTI5NjIyMw@@._V1_UY98_CR36,0,67,98_AL_.jpg",tt4834712,Radiopetti,2017,82.0,Drama,7.1,,"Radiopetti, the story of a man lost in another world, a world of the past, brought alive to his ears by a radioset. How his life journeys with his love for this inanimate thing alongside ...                See full summary »",199,"[{'id': 'nm6217164', 'name': 'Hari Viswanath'}]","[{'id': 'nm5605460', 'name': 'Nivas Adithan'}, {'id': 'nm7435773', 'name': 'Lakshmanan Koratur'}, {'id': 'nm8708173', 'name': 'Shobana Mohan'}, {'id': 'nm7435775', 'name': 'Ramanujam Tvv'}]",ta
"https://m.media-amazon.com/images/M/MV5BMmY2YmY2MTctYzRjYi00Yjg4LWEwY2ItNTk1OTkyYzVlYzhkXkEyXkFqcGdeQXVyMjYwMDk5NjE@._V1_UY98_CR1,0,67,98_AL_.jpg",tt6879472,Yeidhavan,2017,133.0,"Action, Crime, Drama",5.8,,Krishna fights to avenge his sister's death and the future of medical students in this action-packed thriller.,129,"[{'id': 'nm8533353', 'name': 'Sakthi Rajasekaran'}]","[{'id': 'nm1512238', 'name': 'Sandra Amy'}, {'id': 'nm6835490', 'name': 'Gautham'}, {'id': 'nm5296909', 'name': 'Kalaiyarasan'}, {'id': 'nm8987321', 'name': 'Krishna Kumar'}]",ta
"https://m.media-amazon.com/images/M/MV5BYTNlNWU4ZjMtZTVkMi00OGMxLWJkMTEtYzUzODNiOTUxZTBhXkEyXkFqcGdeQXVyNjExNTIyMzQ@._V1_UY98_CR7,0,67,98_AL_.jpg",tt6594854,Yaakkai,2017,127.0,"Romance, Thriller",5.1,,"A hospital administrator dies, and the cop investigating the murder finds that this is just one in a series of grisly crimes.",119,"[{'id': 'nm8818907', 'name': 'Kuzhandai Velappan'}]","[{'id': 'nm2132667', 'name': 'M.S. Bhaskar'}, {'id': 'nm8818908', 'name': 'Hari Krishnan'}, {'id': 'nm2533953', 'name': 'G. Marimuthu'}, {'id': 'nm9737599', 'name': 'Kannan Nayar'}]",ta
"https://m.media-amazon.com/images/M/MV5BZmMwNmFiYWMtNTMyYy00NzFlLThkMDctOTk2NjU0YzdiNzNhXkEyXkFqcGdeQXVyOTk3NTc2MzE@._V1_UX67_CR0,0,67,98_AL_.jpg",tt7055824,Chennai 2 Singapore,2017,122.0,"Comedy, Romance",5.7,,"The film's story is said to be a romantic comedy about a struggling Indian filmmaker, Harish, who makes his way to Singapore to look for investors to finance his dream movie.",163,"[{'id': 'nm3629018', 'name': 'Abbas Akbar'}]","[{'id': 'nm9085870', 'name': 'Gokul Anand'}, {'id': 'nm7981675', 'name': 'Rajesh Balachandiran'}, {'id': 'nm9085872', 'name': 'Emcee Jesz'}, {'id': 'nm9085871', 'name': 'Shiva Keshav'}]",ta
"https://m.media-amazon.com/images/M/MV5BMDMwMjIyY2QtNjU1MC00MzZmLTgwZDItYmU2ZjUzM2FlN2UyXkEyXkFqcGdeQXVyMTEzNzg0Mjkx._V1_UY98_CR9,0,67,98_AL_.jpg",tt7475710,Manusangada,2017,93.0,Drama,7.6,,"When a caste discrimination prevents a villager from giving hos deceased father a rightful burial, he takes his fight for equality to court.",169,"[{'id': 'nm2384917', 'name': 'Amshan Kumar'}]","[{'id': 'nm9326256', 'name': 'Rajeev Anand'}, {'id': 'nm9326257', 'name': 'Manimegalai'}, {'id': 'nm9326259', 'name': 'Sheela Rajkumar'}, {'id': 'nm9326258', 'name': 'A.S. Sasi Kumar'}]",ta
"https://m.media-amazon.com/images/M/MV5BZjM0YThhYTEtNDU3MS00YTMwLTgwNjMtMTNmNjc3NzEzYTkwXkEyXkFqcGdeQXVyMTEzNzg0Mjkx._V1_UY98_CR0,0,67,98_AL_.jpg",tt6656784,Kattappava Kanom,2017,125.0,Comedy,5.4,,"Kattapava Kaanom is a dark comedy film that revolves around a newlywed couple and their pet ish Kattappa, which brings luck whoever owns it.",141,"[{'id': 'nm8852801', 'name': 'Mani Seiyon'}]","[{'id': 'nm6489058', 'name': 'Yogi Babu'}, {'id': 'nm6504384', 'name': 'Mime Gopi'}, {'id': 'nm5650589', 'name': 'Nalan Kumarasamy'}, {'id': 'nm1420794', 'name': 'Chitra Lakshmanan'}]",ta
"https://m.media-amazon.com/images/M/MV5BM2U0ZjJhYmItMTE2OS00YzZlLTg4ZmItN2M2ZjRiODY0YjM3XkEyXkFqcGdeQXVyMTEzNzg0Mjkx._V1_UY98_CR3,0,67,98_AL_.jpg",tt5698088,Paambhu Sattai,2017,140.0,Action,6.2,,A young man in need of cash to solve his personal problems gets into a tangle with a counterfeit money laundering racket.,152,"[{'id': 'nm8124357', 'name': 'Adam Dasan'}]","[{'id': 'nm5654277', 'name': 'Bobby Simha'}, {'id': 'nm7146337', 'name': 'Keerthy Suresh'}, {'id': 'nm5605460', 'name': 'Nivas Adithan'}, {'id': 'nm5877625', 'name': 'Lizzie Antony'}]",ta
"https://m.media-amazon.com/images/M/MV5BNjg5NTRlNGQtMjViZC00NTlkLWI0OGQtZTFkZTllZDBiNGE2XkEyXkFqcGdeQXVyOTk3NTc2MzE@._V1_UY98_CR2,0,67,98_AL_.jpg",tt7539190,Vizhithiru,2017,127.0,Drama,5.9,,"Over the course of one night, a car ride connects a string of people.",121,"[{'id': 'nm3724720', 'name': 'Meera Kathiravan'}]","[{'id': 'nm4572244', 'name': 'Abhinaya'}, {'id': 'nm4271961', 'name': 'Sara Arjun'}, {'id': 'nm1335574', 'name': 'S.P.B. Charan'}, {'id': 'nm6970950', 'name': 'Prathik Devalla'}]",ta
"https://m.media-amazon.com/images/M/MV5BYzg5NWFlNDEtZWQ4MC00YTc1LTk4Y2MtMDVmYTUzMmY4NjYwXkEyXkFqcGdeQXVyNzU2NzAyNzg@._V1_UX67_CR0,0,67,98_AL_.jpg",tt6764780,Dhayam,2017,145.0,Thriller,4.7,,An interview in a room with 8 people. Only one will walking out of the room after one hour and he will be the ceo of the company.,110,"[{'id': 'nm8914829', 'name': 'Kannan Rangaswamy'}]","[{'id': 'nm6549370', 'name': 'Santhosh Prathap'}, {'id': 'nm8914831', 'name': 'Shyam Krishnan'}, {'id': 'nm6787082', 'name': 'Kadhal Kannan'}, {'id': 'nm8914836', 'name': 'Ajay Raj'}]",ta
"https://m.media-amazon.com/images/M/MV5BODA1NzkyZDUtNGQ1MS00MzYyLWFmYmUtZWYwODgxMjYzNzZjXkEyXkFqcGdeQXVyMTEzNzg0Mjkx._V1_UY98_CR2,0,67,98_AL_.jpg",tt7666222,Ulkuthu,2017,127.0,Thriller,6.2,,"Ulkuthu is set in a small coastal town which is ruled by Kaka Mani (Sharath Lohitashwa) and his brother Saravanan (Dhilip Subbarayan), loansharks who deal in blood and blows when their debtors don't pay on time.",110,"[{'id': 'nm3323043', 'name': 'Caarthick Raju'}]","[{'id': 'nm5625923', 'name': 'Dinesh'}, {'id': 'nm7207687', 'name': 'Damodharan K.'}, {'id': 'nm12968885', 'name': 'Adithya Kathir'}, {'id': 'nm5701208', 'name': 'Sharath Lohitashwa'}]",ta
"https://m.media-amazon.com/images/M/MV5BZDI1MTQ5ZTItMmRlOC00OGEyLWE4ZmQtNGVkOTRkYWJhOWFhXkEyXkFqcGdeQXVyMTEzNzg0Mjkx._V1_UY98_CR2,0,67,98_AL_.jpg",tt5440700,Theri,2016,157.0,"Action, Crime, Thriller",7.3,,"When his daughter's life is endangered by a local gang, Joseph Kuruvilla will do whatever it takes to stop them. However, at the same time, his dangerous past slowly resurfaces.",21666,"[{'id': 'nm5961051', 'name': 'Atlee'}]","[{'id': 'nm0897201', 'name': 'Joseph Vijay'}, {'id': 'nm3606487', 'name': 'Samantha Ruth Prabhu'}, {'id': 'nm3367112', 'name': 'Amy Jackson'}, {'id': 'nm8011817', 'name': 'Baby Nainika'}]",ta
"https://m.media-amazon.com/images/M/MV5BOWU2MWVhYjQtNjBiMy00ZTEwLWE5NDctZTZiNjEwZTc3YWZhXkEyXkFqcGdeQXVyODIwMDI1NjM@._V1_UY98_CR8,0,67,98_AL_.jpg",tt4981966,24,2016,164.0,"Action, Comedy, Drama",7.9,,"A scientist invents a time machine, which leads to a bitter battle between his evil twin brother and his son.",23237,"[{'id': 'nm1653460', 'name': 'Vikram K. Kumar'}]","[{'id': 'nm1421814', 'name': 'Suriya'}, {'id': 'nm3606487', 'name': 'Samantha Ruth Prabhu'}, {'id': 'nm3383930', 'name': 'Nithya Menen'}, {'id': 'nm0764853', 'name': 'Saranya Ponvannan'}]",ta
"https://m.media-amazon.com/images/M/MV5BN2Y3ZTE4MzAtZTk3Zi00ZjJjLWJkMDgtOTRkZGRiYmU4YjA0XkEyXkFqcGdeQXVyODIwMDI1NjM@._V1_UX67_CR0,0,67,98_AL_.jpg",tt6380520,Dhuruvangal Pathinaaru,2016,105.0,"Crime, Drama, Mystery",8.2,,"A police officer retires after an accident during a case investigation. Years later, he is forced to relive the past as he narrates the story to his friend's son.",16362,"[{'id': 'nm8678191', 'name': 'Karthick Naren'}]","[{'id': 'nm0706721', 'name': 'Rahman'}, {'id': 'nm8682289', 'name': 'Prakash Raghavan'}, {'id': 'nm6765796', 'name': 'Sharathkumar'}, {'id': 'nm8682292', 'name': 'Santhosh Krishna'}]",ta
"https://m.media-amazon.com/images/M/MV5BZjRjYWIxZjYtMDY0OS00ODE1LTk2ZWMtZjgwOGNiNjg0ZGFkXkEyXkFqcGdeQXVyMTEzNzg0Mjkx._V1_UY98_CR2,0,67,98_AL_.jpg",tt6126294,Remo,2016,151.0,"Comedy, Romance",5.9,,"All's fair in love, even SK, the protagonist, who in this gender-bender of a role masquerades as a woman to nurse his relationship with a lovely young doctor.",2891,"[{'id': 'nm8490638', 'name': 'Bakkiyaraj Kannan'}]","[{'id': 'nm4792434', 'name': 'Sivakarthikeyan'}, {'id': 'nm7146337', 'name': 'Keerthy Suresh'}, {'id': 'nm7742005', 'name': 'Anson Paul'}, {'id': 'nm3951906', 'name': 'Sathish'}]",ta
"https://m.media-amazon.com/images/M/MV5BYjEyOGU5ZDEtMDMwZi00YmUxLTg3MTEtNjdlOGE2NDBlYjA0XkEyXkFqcGdeQXVyMTEzNzg0Mjkx._V1_UY98_CR7,0,67,98_AL_.jpg",tt4741412,Uriyadi,2016,91.0,"Action, Crime, Drama",7.9,,Four friends studying in an engineering college unintentionally end up becoming a part of caste politics led by corrupt politicians.,2626,"[{'id': 'nm7373491', 'name': 'Vijay Kumar'}]","[{'id': 'nm7373491', 'name': 'Vijay Kumar'}, {'id': 'nm8207693', 'name': 'Chandru'}, {'id': 'nm6504384', 'name': 'Mime Gopi'}, {'id': 'nm8207694', 'name': 'Citizen Sivakumar'}]",ta
"https://m.media-amazon.com/images/M/MV5BZWQ4MDZjNWYtZDE1Zi00MjY3LWFmNjktYjYxMWI2OTBhOTZmXkEyXkFqcGdeQXVyMTEzNzg0Mjkx._V1_UY98_CR3,0,67,98_AL_.jpg",tt5200962,Kadhalum Kadanthu Pogum,2016,136.0,"Comedy, Drama, Romance",7.4,,"An unlikely romance brews between a tough-acting thug with a tender heart, and a recently single, IT consultant neighbor, in this lighthearted and wacky twist of a romantic comedy.",3377,"[{'id': 'nm5650589', 'name': 'Nalan Kumarasamy'}]","[{'id': 'nm4043111', 'name': 'Vijay Sethupathi'}, {'id': 'nm7371790', 'name': 'Madonna Sebastian'}, {'id': 'nm2284321', 'name': 'Samuthirakani'}, {'id': 'nm8030431', 'name': 'G.M. Sundar'}]",ta
"https://m.media-amazon.com/images/M/MV5BZjVkMjkxZTktY2Q3ZC00ZGNlLWE2OTQtMmI4NjgwYzZjOTVmXkEyXkFqcGdeQXVyMTEzNzg0Mjkx._V1_UY98_CR2,0,67,98_AL_.jpg",tt5849148,Appa,2016,124.0,Drama,7.9,,"Dhayalan, a friendly father, encourages his son to pursue his dreams. In contrast, Singaperumal imposes his own perspective on his son while Nadunilayan is disinterested in his boy's future.",1413,"[{'id': 'nm2284321', 'name': 'Samuthirakani'}]","[{'id': 'nm6650018', 'name': 'Preethi Christina Paul'}, {'id': 'nm11616352', 'name': 'Gabriella Charlton'}, {'id': 'nm6334521', 'name': 'Namo Narayana'}, {'id': 'nm4446366', 'name': 'Thambi Ramaiah'}]",ta
